,Header,Summary,Detail,Link,Category,CreationDate
11,"Swabi admin, police vow foolproof security for Chinese nationals",SWABI: The police and the district administration on Wednesday vowed to provide foolproof security to the Chinese...,"SWABI: The police and the district administration on Wednesday vowed to provide foolproof security to the Chinese nationals working on the Fifth Extension Project of Tarbela Dam. 
The decision was taken at a joint meeting held here, according to press release. 
District police officer Haroon Rashid, assistant deputy commissioner Gohar Ali, DSP Topi circle Mohammad Shafiq Khan, Counter-Terrorism Department DSP Khalid Iqbal Khan, district security branch in-charge Aamir Khan, the Tarbela Dam’s Chinese camp security officer, chief engineer Tarbela Dam, and other relevant officials were in attendance. 
The special meeting was called in the wake of the suicide attack on Chinese engineers in Bisham area of Shangla district on March 26 to further improve the security of Chinese workers. 
After the attack work on the Fifth Extension Project was halted. 
However, the construction activities resumed three days ago as the district police have taken extraordinary steps for the protection of Chinese nationals. 
Since the attack, the district police officer, the regional police officer, commissioner Mardan division and Swabi deputy commissioner have visited the Chinese camp several times to check the security measures taken for protection of foreign nationals. 
The district police have also issued a security advisory to the project authorities to take precautionary measures while keeping in mind the prevailing situation in the country and importance of the security of Chinese workers and officials. 
The meeting discussed implementation of the security policy directives and reinforcing the fencing around the China camp. 
FIRING IN AIR: The police have sought people’s cooperation to help curb firing in the air on the Chand Raat. 
In a video message on Wednesday, DSP Jawad Khan appealed to the people to curb such acts that harmed the life of a human being. 
He said firing in the air on Chand Raat often resulted in deaths and injuries, and urged people, especially youth, not to indulge in this dangerous practice.
Published in Dawn, April 4th, 2024
",https://www.dawn.com/news/1825526/swabi-admin-police-vow-foolproof-security-for-chinese-nationals,peshawar,2024-04-04
12,PHC seeks PTA reply over ‘disruption’ of internet service in Peshawar,PESHAWAR: The Peshawar High Court on Wednesday sought replies from Pakistan Telecommunication Authority (PTA) and...,"PESHAWAR: The Peshawar High Court on Wednesday sought replies from Pakistan Telecommunication Authority (PTA) and ministry of information technology to a petition filed against disruption of cellular internet service during night time in the provincial capital for over two weeks.
A bench consisting of Justice Ijaz Anwar and Justice Wiqar Ahmad issued the order over a petition filed by a citizen, Amir Khan, stating that the suspension of cellular internet services at night had been affecting online businesses as well as students dependent on it for studies.
Advocate Fawad Afzal Safi appeared for the petitioner and contended that the provincial capital had been experiencing disruptions in cellular internet services for around 20 days, leading to inconvenience and raising concerns among the people.
He stated that the authorities had not been giving any genuine reason for this practice.
He contended that the suspension of internet facility of different cellular phone companies often started at 10pm and continued till 6am in the morning.
He said that the worst areas of this suspension included Peshawar city, University Road, Garhi Qamardin, Bahader Kelay, Gulshan Rahman Colony, Hazarkhwani, and several other areas in the outskirt of the provincial capital.
The counsel stated that hundreds of thousands of cellular phone subscribers were affectees of this internet suspension.
He contended that being regulator of cellular phone services, it was the responsibility of the PTA to look into this matter.
He stated that the impugned practice of suspension of internet services in Peshawar was discrimination with the inhabitants of this city which was a violation of article 25 of the Constitution.
He requested the court to issue directives to the PTA and other relevant agencies to ensure the regular supply of cellular internet services.
Moreover, he contended that the cellular services provided by different companies were also substandard but the PTA had not been taking action against them.
Published in Dawn, April 4th, 2024
",https://www.dawn.com/news/1825525/phc-seeks-pta-reply-over-disruption-of-internet-service-in-peshawar,peshawar,2024-04-04
13,Ghazi villagers ask NTDC to pay for their land,HARIPUR: A jirga comprising elders of several villages here on Wednesday demanded that the National Transmission and...,"HARIPUR: A jirga comprising elders of several villages here on Wednesday demanded that the National Transmission and Distribution Company compensate them for the installation of overhead high-voltage power lines on their land.
It met on the lawns of the Ghazi tehsil municipal administration, with tehsil council chairman Sahibzada 
Qasim Shah, heads of the affected village councils, and local notables in attendance.
The NTDC is set to install power transmission lines and pylons for supplying electricity from 1530mw Tarbela 5th Extension hydropower project to the National Grid.
The participants discussed the project slated for completion in May 2026 and its impact on the local population and the agriculture sector.
They said Ghazi residents sacrificed their fertile lands for Tarbela Dam, but those sacrifices were hardly acknowledged by authorities.
The participants said the installation of transmission lines and pylons would render hundreds of acres of land in Kundi, Hamlet, Khairbara, and Kotehra union councils “useless for future housing and development.”
They said four transmission lines and pylons were already installed on the route.
The jirga demanded appropriate compensation for landowners affected by the project.
It also called for the launch of community development projects in line with the conditions set by the World Bank, the funding agency for the Tarbela 5th Extension project.
The jirga demanded an end to power outages in the areas affected by Tarbela Dam projects.
It also said dumpers were damaging the main Ghazi roads, so the activity should be banned.
The jirga formed a committee to hold talks with the NTDC on the issue.
BODY FOUND: The police found the body of a suspected criminal here.
They insisted that the outlaw died from bullets fired by his fleeing accomplices within the limits of the City Police Station.
The police also held a man with bullet injuries.
A police team led by SHO (City) Ihjaz Ali signaled four men riding two motorcycles to stop at a picket near Chak Shah Mohammad on Tuesday evening, but they sped away, according to a statement issued by the office of district police officer Suleman Zafar.
It added that the police chased motorcycles, but one of them slipped, causing two riders to fall to the ground, while the other motorcyclists fled, firing gunshots at the policemen.
The police said one of the riders, Kamran of Fateh Jang, died on the spot, while the other, Faisal of Rawalpindi, suffered injuries.
They insisted that the man was killed and the other injured by the fleeing motorcyclists.
The police found a pistol on the body and claimed the man was part of a criminal gang.
Published in Dawn, April 4th, 2024
",https://www.dawn.com/news/1825524/ghazi-villagers-ask-ntdc-to-pay-for-their-land,peshawar,2024-04-04
14,Community should be involved in water project designs: experts,"ISLAMABAD: A diverse group of experts has stressed the need for active engagement, ensuring water rights awareness,...","ISLAMABAD: A diverse group of experts has stressed the need for active engagement, ensuring water rights awareness, and harnessing local wisdom and indigenous knowledge for project designs.
The suggestion was made during a groundbreaking consultation on community-led ‘climate-resilient water governance models in Pakistan’. The event was hosted by the International Rescue Committee and the National Disaster Risk Management Fund and aimed to gather expert insights on enhancing resilient water governance systems and policy reforms to tackle the challenges posed by extreme weather events, such as floods and droughts, exacerbated by the impacts of climate change.
Experts highlighted the scarcity of skills and technical personnel to promote market-oriented water management and the need for proper data for informed decision-making. 
They emphasised the importance of documenting lessons from past experiences to inform future strategies and policies, as well as promoting private sector support for value addition in agriculture sectors in hill torrent areas.
They stressed for clear guidelines for engaging semi-urban/urban segments in water governance systems.
Among the attendees were representatives from Sindh Agriculture University, Tandojam, the Pakistan Council of Research in Water Resources, the Member Planning Commission, the Sustainable Development Policy Institute, ZIZak, USAID’s Higher Education System Strengthening Activity, the Natural Resources Division (NRD), the Pakistan Agricultural Research Council (PARC), civil society representatives, and others.
Shabnam Baloch, Country Director, International Rescue Committee (IRC), and Mr. Bilal Anwar, CEO of the National Disaster Risk Management Fund (NDRMF), facilitated the conversation and emphasised the importance of incorporating the voice of local communities into project designs and policy formulations.
Published in Dawn, April 4th, 2024
",https://www.dawn.com/news/1825523/community-should-be-involved-in-water-project-designs-experts,peshawar,2024-04-04
15,Khidmat Markaz helps curb crime in Chitral,DPO says centre bridges public-police gap,"CHITRAL: A services’ centre established in the police lines here has helped bridge the public-police gap. 
Talking to reporters here, Lower Chitral acting district police officer Abdul Sattar said different facilities were made available at the Khidmat Markaz. 
He said it consisted of six different sections, including command and control room, Ababeel Squad control room, licence section, traffic education section, police assistance lines and gender response section. 
He said the command and control room kept watch on a vehicle entering the district from the Lowari tunnel till it reached the city, thus enabling the police to identify any suspected person arriving here from other districts. 

DPO says centre bridges public-police gap

Mr Sattar said the command and control room established last year had helped reduce the number of thefts and robberies in the city after the culprits were successfully traced with the help of CCTV cameras. 
He said the Kalash valley of Bumburate had already been connected to the control room to provide foolproof security to the tourists. 
He said the control room of Ababeel Squad mobilised its riders to the trouble spot to give a brisk and rapid response in accidents, disasters and crimes of different nature. 
DPO Sattar said the gender response section had proved a great source of relief and consolation to the women in distress or victims of domestic violence. “Since the inception of this facility, the number of suicide cases among women has reduced drastically.” 
He said the aggrieved women dashed to the centre without hesitation because a woman officer along with her supporting woman constable was deployed there. 
RESULTS CHANGED: Result of the election for president of Chitral chapter of Pakistan Football Federation (PFF) has allegedly been changed to hand over win to the losing candidate. 
This was claimed by Zaheer Baber, a supporter of Kamal Abdul Jamil, one of the contenders for the president’s slot. 
He told Dawn that the Electoral College consisted of the presidents of football clubs registered with PFF, and there were 13 registered clubs in Chitral having the right of vote. 
He said presidents of the clubs participated in the voting process through WhatsApp, claiming that seven had voted in favour of Mr Jamil, but the results were altered. 
He said to their utter surprise and dismay, a notification was issued declaring Ejaz Ahmed the winner with seven votes. 
He said Mr Jamil had filed an appeal against the results, and requested for vote recount.
Published in Dawn, April 4th, 2024
",https://www.dawn.com/news/1825522/khidmat-markaz-helps-curb-crime-in-chitral,peshawar,2024-04-04
16,Timely completion of dam project sought,LAKKI MARWAT: Bannu division commissioner Parweiz Sabatkhel has asked the relevant authorities to expedite work on...,"LAKKI MARWAT: Bannu division commissioner Parweiz Sabatkhel has asked the relevant authorities to expedite work on Kurrum Tangi Dam project and ensure its completion within the scheduled time.
While chairing a high-level meeting at his office in Bannu on Wednesday, he said the project was of vital importance and it would change the destiny of the people of entire southern region of the province.
Bannu deputy commissioner Shah Saud, assistant commissioner Miramshah Khalid Imran, project director Mohammad Shafiq Bitanni and other relevant officials were in attendance.
The divisional commissioner said the dam would also generate electricity thus helping to boost industries and businesses and provide employment opportunities in Bannu division.
He directed the authorities to speed up their efforts for timely completion of the project.
Published in Dawn, April 4th, 2024
",https://www.dawn.com/news/1825521/timely-completion-of-dam-project-sought,peshawar,2024-04-04
