,Header,Summary,Detail,Link,Category,CreationDate
8,Water filtration plants in Pindi division to be upgraded,RAWALPINDI: Six district administrations plan to upgrade 323 out of total 329 water filtration plants functioning in...,"RAWALPINDI: Six district administrations plan to upgrade 323 out of total 329 water filtration plants functioning in Rawalpindi division.
This was informed a meeting held in commissioner’s office to review the functioning of filtration plants in six districts of Rawalpindi division including Rawalpindi, Attock, Chakwal, Jhelum, Murree and Talagang.
The dysfunctional filtration plants will be operational within a week, the meeting was informed.
The commissioner directed that the Executive Engineer public health should be assigned duty in every district to conduct water testing of all filtration plants, to ensure the quality of water. Punjab caretaker minister for primary and secondary health Dr Jamal Nasir also attended the meeting along with Rawalpindi Commissioner Liaquat Ali Chattha.
The commissioner said that the Punjab caretaker government was committed to providing clean drinking water to the people, therefore, along with the installation of new plants, it is also necessary to ensure that every plant already installed is fully functional.He directed that all the filtration plants should be fully operational with in one week.
Liaquat Ali Chattha said that every filtration plant should be given a universal number and the details of who is responsible for the maintenance of this plant. He said that cleanliness of the filtration plant is very important, the staff responsible for the safety of the plant should take special care of cleanliness.
He said that providing clean drinking water is our responsibility as well as a good work, in which we have to work with full responsibility. Apart from this, the surrounding philanthropists should also be encouraged to participate in this charity so that more and more filtration plants can be installed to provide clean drinking water to the people.
On this occasion, while briefing about the details of the existing filtration plants in Rawalpindi Division, it was informed that there are a total of 329 filtration plants in Rawalpindi Division, of which 323 are functional and six are non-functional.
According to the details, there are 163 out of 168 functional filtration plants in Rawalpindi district.Attock district has a total of 66 plants out of which 64 are operational.Similarly, seven of the total eight plants are operational in Chakwal while total 87 filtration plants of Jhelum district are complete and operational.
Liaquat Ali Chatha directed that this figure should be 100pc by removing the bottlenecks in the non-functional plants by next week, after which the third party validation of these plants will also be done.
Published in Dawn, May 9th, 2023
",https://www.dawn.com/news/1751617/water-filtration-plants-in-pindi-division-to-be-upgraded,islamabad,2023-05-09
9,Thalassaemia patients to be thoroughly facilitated: Pims head,"Walk to raise awareness about disease organised; screening, tests of children to be done free-of-cost next week","ISLAMABAD: Walks were held on Monday at Pakistan Institute of Medical Sciences (Pims) and F-9 Park to observe World Thalassaemia and Red Cross/Red Crescent Days.
Pims Executive Director Dr Rana Imran Sikandar said that all possible facilities would be provided to children suffering from the disease. In charge of the blood bank Dr Farwa Sajeel said that staff of the blood bank will take all possible steps to ensure timely supply of blood to children.
Another speaker, Tanveer Noshahi, said children, suffering from thalassaemia deserved attention of the whole society.
It is worth mentioning that according to estimates, over 100,000 thalassaemia major patients exist in the country. There are three types of thalassaemia: minor, major and intermedia. Persons with thalassaemia major suffer all their life and patients with thalassaemia intermedia can get thalassaemia major any time whereas persons with thalassaemia minor live normally but still carry the virus of the disease and can transmit it to their offspring.

Walk to raise awareness about disease organised; screening, tests of children to be done free-of-cost next week

Due to the disease, the body stops making red blood cells due to which blood is given to the patients. The only cure for it is a bone marrow transplant which is not only very expensive but requires a donor. The disease can be detected with a simple blood test and patients have to take medicines worth thousands of rupees and blood once and sometimes twice a month.
World Red Cross Red Crescent Day
The Pakistan Red Crescent Society (PRCS) and the International Committee of the Red Cross (ICRC) jointly organised an awareness walk at F-9 Park on Monday in connection with Red Cross Red Crescent Day celebrations under the theme ‘Everything we do comes #fromtheheart’.
The walk was aimed at raising public awareness about the humanitarian work carried out by PRCS and the Red Cross Red Crescent Movement partners in Pakistan.
The event was attended by PRCS Secretary General Mohammad Abaidullah Khan, staff from PRCS, ICRC and other partners in Pakistan including the Turkish Red Crescent, Norwegian Red Cross, and German Red Cross, as well as volunteers, students, and people from different walks of life.
The participants carried banners and placards with messages highlighting the importance of humanitarian work. A cake-cutting ceremony was also held to mark celebrations.
PRCS Chairman Sardar Shahid Ahmed Laghari said that in Pakistan, organisations continued to face numerous humanitarian challenges, from natural disasters such as earthquakes and floods to conflict-induced displacement and food insecurity and in such difficult times, PRCS, along with its partners, has remained steadfast in its commitment towards providing essential humanitarian assistance to those in need.
“Let us continue to work together, from the heart, towards a more just and equitable world,” he said.
Rawalpindi
The Punjab caretaker government will provide all medical facilities to thalassaemia patients and in this regard, the screening of children and all tests will be done free-of-cost next week and 100 percent treatment will be ensured along with vaccination of sick children. 
This was stated by Punjab caretaker Minister Dr Jamal Nasir while speaking as a special guest at the event organised by the Thalassaemia Welfare Society.
He said the day is celebrated to raise awareness about thalassaemia, worldwide, adding that donors should play their role to help children suffering from the disease. Thalassaemia Society President retired Major General Sohaib, retired Lt General Kamal Akbar, Professor Abdul Qayyum, Dr Lubna Zafar, Dr Zahra, Dr Shahzad, Dr Naima, patients and their family members participated in the ceremony.
Dr Nasir said that the purpose of organising the ceremony was to share the happiness of people affected by thalassaemia and their families and to pay homage to their courage and independence. He said that thalassaemia is a hereditary disease that is transmitted from parents to children. Due to lack of awareness about hereditary diseases, the rate of spread of this disease is increasing, he added.
Published in Dawn, May 9th, 2023
",https://www.dawn.com/news/1751616/thalassaemia-patients-to-be-thoroughly-facilitated-pims-head,islamabad,2023-05-09
10,Mills seek subsidised wheat promised by govt,ISLAMABAD: The flour mills of Rawalpindi and Islamabad have asked the government to release the promised subsidised...,"ISLAMABAD: The flour mills of Rawalpindi and Islamabad have asked the government to release the promised subsidised wheat against the additional stocks the government procured for free flour distribution during Ramazan.
The Pakistan Flour Mills Association (PFMA)- Rawalpindi- Islamabad chapter has also criticised the Punjab Food Department for, what it said, creating hurdles to the procurement of wheat from the farmers.
The association held an emergency meeting here with vice chairman Khawaja Mohammad Imran in the chair and noted that three weeks had passed but the food department had yet to release the susidised wheat stock.” “As a result around 95pc flour mills in the region were currently not operational.”
Since, the Potohar was not a prime wheat growing area compared to vast plains of Southern and Central Punjab, wheat is largely imported from other districts to this region to feed the growing urban population in here. 
Published in Dawn, May 9th, 2023
",https://www.dawn.com/news/1751615/mills-seek-subsidised-wheat-promised-by-govt,islamabad,2023-05-09
11,"EOBI board members have not been replaced since 2013, Senate body told","The institution is still a federal subject due to differences among provinces over its devolution, participants told.","ISLAMABAD: Standing Committee on Overseas Pakistanis and Human Resource Development was informed on Monday that the members of EOBI Board have not been replaced since 2013 as the institution was still a federal subject due to differences among provinces over its devolution.
The meeting was informed that since the devolution, both the Punjab and Sindh provinces have refused to accept EOBI as a federal subject and that is why its members have not been replaced in all these years.
After the passage of Eighteenth Amendment Act, 2010, EOBI was supposed to be devolved to provinces like many other ministries, departments, institutions.
But it could not be devolved due to differences amongst provinces over its devolution. 
The two smaller provinces of Balochistan and Khyber Pakhtunkhwa opposed its devolution whereas Sindh and Punjab want it transferred to provinces. Now, as EOBI remains a federal subject, the two provinces Balochistan and Khyber Pakhtunkhwa have accepted it but the other two provinces have refused to accept this decision.
Senator Shahadat Awan raised the issue and asked why the members of EOBI Board have not been changed since 2013.  In reply, it was informed that since the devolution, both the Punjab and Sindh provinces have refused to accept EOBI as a federal subject and that is why its members have not been replaced in all these years.
The Committee was briefed by Chairperson Employees Old Age Benefits Institution (EOBI) Naheed Shah Durrani regarding the role and working of the institution. 
She apprised that EOBI is a leading institution which provides social security to its citizens to enhance the quality of their lives. She informed that EOBI has received a contribution of Rs180 billion during the last ten years. Moreover, during the financial year 2022-23, EOBI is expected to receive a contribution of Rs38 billion against an approved target of Rs33 billion, she added.
However, despite the importance of EOBI, no attention has been given over strengthening the administrative structure and Board of EOBI, she stated.
The meeting was attended by Senator Manzoor Ahmed Kakar, State Minister for Law and Justice Senator Shahadat Awan, Senator Shaheen Khalid Butt, Senator Muhammad Asad Ali Khan Junejo, Senator Prince Ahmed Omer Ahmed Zai and other senior officers of the relevant departments.
Published in Dawn, May 9th, 2023
",https://www.dawn.com/news/1751614/eobi-board-members-have-not-been-replaced-since-2013-senate-body-told,islamabad,2023-05-09
