,Header,Summary,Detail,Link,Category,CreationDate
10,Vietnam reports record-high temperature,The country’s scientists have warned that global warming is exacerbating adverse weather.,"HANOI: Vietnam has reported a record-high temperature, with climate experts warning such extreme weather events would continue.
The country’s scientists have warned that global warming is exacerbating adverse weather, with the region sweltering under a heatwave in April — when neighbouring countries also registered record temperatures.
A temperature of 44.1 degrees Celcius (111.38 degrees Fahrenheit) was measured in Vietnam on Saturday, the National Centre for Hydro Meteorological Forecasting said, breaking the 2019 record of 43.4 degrees Celsius.
Farmer Nguyen Thi Lan said that temperatures in the central city of Danang had been increasingly hot, forcing workers to start earlier than ever. “We have had to finish before 10am to avoid the heat,” she said. Lan said forecasters said temperatures had risen to nearly 40 degrees Celsius.
“But at lunchtime, I think it was much hotter.” Vietnam’s weather varies from north to south, but the entire country is now entering its hottest summer months.
The record temperature was measured indoors at Hoi Xuan station in northern Thanh Hoa province. It topped the previous high of 43.4 degrees Celsius, recorded in April 2019 at Huong Khe District in central Ha Tinh Province.
“This is a worrying record in the context of climate change and global warming,” climate change expert Nguyen Ngoc Huy said from the capital Hanoi.
Published in Dawn, May 8th, 2023
",https://www.dawn.com/news/1751521/vietnam-reports-record-high-temperature,international,2023-05-08
11,7 pedestrians killed in  Texas accident,Houston: Seven pedestrians were killed and several others injured on Sunday when an SUV mowed down people near a...,"Houston: Seven pedestrians were killed and several others injured on Sunday when an SUV mowed down people near a homeless shelter that attends to migrants in Brownsville, Texas.
The male driver was in custody, a police official said, adding he was charged with reckless driving and could face additional charges.
The victims in the morning crash were waiting at a bus stop near a shelter for the homeless used by migrants. He said some migrants were among the dead.
“We are doing an investigation in forms of intoxication to see if he was intoxicated at the time of the accident,” said Sandoval, the police official.
The city of Brownsville, on the border with Mexico, is one of the places expecting an influx of migrants when Covid-era restrictions expire on Thursday.
A video circulating online purporting to show the crash shows a speeding SUV plowing into a row of people sitting on the curb. 
Published in Dawn, May 8th, 2023
",https://www.dawn.com/news/1751520/7-pedestrians-killed-in-texas-accident,international,2023-05-08
12,Yellen warns of crisis if Congress fails to act on debt,WASHINGTON: US Treasury Secretary Janet Yellen on Sunday issued a stark warning that a failure by Congress to act on...,"WASHINGTON: US Treasury Secretary Janet Yellen on Sunday issued a stark warning that a failure by Congress to act on the debt ceiling could trigger a “constitutional crisis” that also would call into question the federal government’s creditworthiness.
Yellen sounded the alarm over possible financial market consequences if the debt ceiling is not raised by early June, when she has said the federal government could run short of cash to pay its bills.
The negotiations on the issue should not take place “with a gun to the head of the American people”, Yellen told the ABC programme This Week. Biden has asked Congress to raise the debt ceiling with no conditions. The Republican-led House of Representatives last month passed a bill that would raise the government’s $31.4 trillion debt ceiling, but the measure included sweeping spending cuts over the next decade that Biden and his fellow Democrats oppose.
Biden is preparing to meet on Tuesday at the White House with Republican House Speaker Kevin McCarthy, Republican Senate Minority Leader Mitch McConnell and top congressional Democrats to discuss the issue.
“It’s Congress’s job to do this. If they fail to do it, we will have an economic and financial catastrophe that will be of our own making,” Yellen said.
“And we should not get to the point where we need to consider whether the president can go on issuing debt. This would be a constitutional crisis,” Yellen added. 
Biden has steadfastly said he will not negotiate over the debt ceiling increase, but would discuss budget cuts after a new limit is passed. 
Published in Dawn, May 8th, 2023
",https://www.dawn.com/news/1751519/yellen-warns-of-crisis-if-congress-fails-to-act-on-debt,international,2023-05-08
13,20 drown after boat capsizes in India’s Kerala,Minister says death toll likely to rise.,"COCHIN: Twenty people drowned after a boat capsized off the coastal town of Tanur, in India’s southern state of Kerala, on Sunday.
The death toll was likely to rise as the boat was stuck in muddy waters and was being pulled out to rescue those trapped inside, Kerala’s minister for fisheries and harbour development Abdurahiman told reporters. 
The minister said 12 bodies had been identified so far.
The incident in the Malappuram district of the state took place around 7pm local time and a team from India’s disaster response force was at the site, a spokesperson said. 
“Pained by the loss of lives due to the boat mishap in Malappuram, Kerala,” Prime Minister Narendra Modi said in a tweet.­
Published in Dawn, May 8th, 2023
",https://www.dawn.com/news/1751518/20-drown-after-boat-capsizes-in-indias-kerala,international,2023-05-08
14,Hollywood strikes inflamed by claim AI could do writers’ jobs,"LOS ANGELES: The Hollywood writers’ strike broke out this week over pay, but the refusal of studios like Netflix...","LOS ANGELES: The Hollywood writers’ strike broke out this week over pay, but the refusal of studios like Netflix and Disney to rule out artificial intelligence replacing human scribes in the future has only fuelled anger and fear on the picket lines.
With their rapidly advancing ability to eerily mimic human conversation, AI programs like ChatGPT have spooked many industries recently. The White House this week summoned Big Tech to discuss the potential risks.
As part of the weeks-long talks with studios and streamers that collapsed on Monday, the Writers Guild of America asked for binding agreements to regulate the use of AI.
Under the proposals, nothing written by AI can be considered “literary” or “source” material — industry terms that decide who gets royalties — and scripts written by WGA members cannot “be used to train AI.” But according to the WGA, studios “rejected our proposal,” and countered with an offer merely to meet once a year to “discuss advancements in technology.” 
“It’s nice for them to offer to have a meeting about how they’re exploiting it against us!” joked WGA negotiating committee member Eric Heisserer, who wrote Netflix hit film “Bird Box.” “Art cannot be created by a machine. You lose the heart and soul of the story... I mean, the first word is ‘artificial,’” he said on the picket line outside the streaming giant’s Hollywood HQ.
While writers already know this, the danger is that “we have to watch tech companies destroy the business in an attempt to find out for themselves,” he said.
‘Not just scripts’
While few television and film writers who spoke to agency on the picket lines believe their work could be done by computers, the apparent conviction of studios and streamers that it can has been an extra slap in the face.
They fear that belt-tightening executives in Hollywood, where Silicon Valley companies have upended many traditional practices such as long-term contracts for writers, may seek to cut costs further by getting computers to write their next hit shows.
Comments by top Hollywood executives at this week’s Milken Institute Global Conference in Beverly Hills will have done nothing to quell writers’ concerns.
“In the next three years, you’re going to see a movie that was written by AI made... a good one,” said movie producer Todd Lieberman.
“Not just scripts. Editing, all of it... storyboarding a movie, anything,” added Fox entertainment CEO Rob Wade.
“AI in the future, maybe not next year or the year after, but if we’re talking 10 years? AI is going to be able to do absolutely all of these things.” The studios’ own account of the breakdown in WGA talks offered a more nuanced take.
In a briefing note, they said writers do not in fact want to outlaw AI, and appear happy to use it “as part of their creative process” — so long as it does not affect their pay.
That scenario “requires a lot more discussion, which we’ve committed to doing,” the studios said.
‘Guardrails’
For Leila Cohan, a 39-year-old writer on Netflix smash hit “Bridgerton,” the only usefulness of AI for writers is limited to “busy work” such as coming up with names for characters.
But she predicted that studios “could start making incredibly bad first drafts with AI and then hiring writers to do a rewrite.” “I think that’s certainly a very scary possibility... it’s very smart that we’re addressing this now,” she said.
Indeed, the last Hollywood strike in 2007-08 won writers the right to be paid for online viewing of their shows or films — highly prescient, at a time when streaming was in its infancy.
Back then, Netflix had barely started online viewing, and the likes of Disney+ and Apple TV+ were more than a decade away.
Even for sci-fi writer Ben Ripley, who believes there is no role whatsoever for AI in writing, introducing legislation now “to put guardrails up” is “very necessary.” Writers “have to be original,” he said. “Artificial intelligence is the antithesis of originality”.
Published in Dawn, May 8th, 2023
",https://www.dawn.com/news/1751517/hollywood-strikes-inflamed-by-claim-ai-could-do-writers-jobs,international,2023-05-08
