,Header,Summary,Detail,Link,Category,CreationDate
8,Two ex-BIEK chairmen among eight given pre-arrest bail,KARACHI: The special provincial anti-corruption court granted interim bail to eight current and former officials of...,"KARACHI: The special provincial anti-corruption court granted interim bail to eight current and former officials of the Board of Intermediate Education Karachi (BIEK) in a case pertaining to tampering with the results, it emerged on Tuesday.
Former BIEK chairmen Saeeduddin and Naseem Ahmed and then examination officials Anwar Aleem, Zaheeruddin Bhutto, Aslam Chohan, Tanveer Abbas Zaidi, Abdul Haris Farooqi and Muhammad Athar appeared before Sindh Anti-Corruption Court Judge Muhammad Ahsan Durrani to seek pre-arrest bail.
The applicants’ counsel argued that the registration of the FIR against their clients was ‘illegal’.
After hearing their arguments, the court granted the interim pre-arrest bail against the surety bond of Rs100,000 each, without touching the merits of the case.
The court adjourned the hearing till March 29.
The case was registered on Feb 2 with the anti-corruption zone (West) against the suspects based on the recommendations of an inquiry committee formed on the direction of the Sindh caretaker chief minister.
The committee recommended for taking “criminal actions against officials/ officers who have been found involved in the tampering and manipulation of the annual examinations”.
A case was registered under Sections 409 (breach of trust by a public servant,), 420 (cheating and dishonesty), 465 (forgery), 468 (purpose of cheating), 471 (using as genuine a forged document), 34 (common intention) of the Pakistan Penal Code read with 5 (2) of the Prevention of Corruption Act 1947.
Published in Dawn, February 28th, 2024
",https://www.dawn.com/news/1817655/two-ex-biek-chairmen-among-eight-given-pre-arrest-bail,karachi,2024-02-28
9,ATC sentences man to death in PPP worker’s murder case,Acquits five co-accused for lack of evidence,"KARACHI: An antiterrorism court (ATC) sentenced a man, said to be associated with the Muttahida Qaumi Movement, to death on two counts in a case pertaining to the murder of a Pakistan Peoples Party worker in Orangi Town on Tuesday.
The court acquitted five co-accused due to lack of evidence against them.
The ATC announced its verdict after recording evidence and arguments from both sides.
The court found Shakeel alias Banarsi guilty of killing Ijaz alias Mushka in December 2012 within the jurisdiction of the Pakistan Bazaar police station.
The judge also sentenced him to death for possession of an unlicensed weapon.

Acquits five co-accused for lack of evidence

“The accused committed murder in a ruthless, cruel and brutal manner, thus is not entitled to leniency,” the court ruled in the verdict. 
The court observed that the “proof of motive is not a legal requirement” while imposing the death penalty for murder.
The court also imposed a fine of a total of Rs600,000 and in case of default, the convict would undergo an additional two-year imprisonment.
Regarding the co-accused — Zulfiqar alias Zulfi, Afsar Hussain, Adil alias Pagla, Manzoor alias Bakra and Kashif Siddiqui — the court acquitted them and ruled that the prosecution failed to prove its case against them.
According to the prosecution, the victim was sitting outside his house in Orangi Town when four persons on two motorcycles emerged there, opened fire on him and rode away.
The wounded victim was immediately shifted to a hospital where doctors pronounced him death during the treatment.
The convict was apprehended by the Azizabad police station for possessing explosive substance. During interrogation, he disclosed to his involvement in the killing of the PPP worker.
The police had recovered a 9mm pistol on a lead provided by him.
A case was registered under Sections 302 (premeditated murder), 109 (abetment), and 34 (common intention) of the Pakistan Penal Code read with Section 7 of the Anti-Terrorism Act and Section 23 (i) of the Sindh Arms Act.
Published in Dawn, February 28th, 2024
",https://www.dawn.com/news/1817652/atc-sentences-man-to-death-in-ppp-workers-murder-case,karachi,2024-02-28
10,Robbers kill passer-by in New Karachi,"KARACHI: A passer-by was shot dead by armed robbers in the New Karachi area on Tuesday, police said.","KARACHI: A passer-by was shot dead by armed robbers in the New Karachi area on Tuesday, police said.
The victim, identified as Shabbir Qasim, was a watchman at a factory in the area. 
SSP-Central Zeeshan Shafiq Siddiqi said CCTV footage showed that armed robbers were looting a citizen in the area and when he put up resistance, the muggers resorted to firing. As a result, a bullet hit passer-by Shabbir who was on his way to have breakfast.
He was taken to the Abbasi Shaheed Hospital where doctors declared him dead upon arrival.
Four shot dead in separate incidents across city A 70-year-old man, Iqbal Ismail, was shot dead in Nazimabad’s Gol Market on Tuesday, police said.
Central SSP Zeeshan Shafiq Siddiqi said the murder may be related to some enmity. He added that the deceased was allegedly involved in a murder case in the past. However, the victim’s son, Asif, told the media that they had no enmity with anyone. He said his father was on his way to offer fajr prayer when he was killed.
The victim had retired from the shipping industry and he was a resident of Nazimabad-3. The police said CCTV footage obtained from the area showed that two armed pillion riders had ostensibly chased and killed him.
In a separate incident, Abdul Majeed, 45, was shot and killed by unknown suspects due to personal enmity inside his house in Mehran Town near Shaitan Chowk.
Korangi Industrial Area SHO Faraz Ali Khan said some unidentified suspects entered the victim’s house and killed him. He added that the victim was arrested in a criminal case and sent to prison in the past. He was released from prison in Sept 2023. He had two wives and the police suspected that the murder might be related to his second wife, said the SHO.
Whereas a 41-year-old man was found shot dead in Manzoor Colony on Tuesday.
Baloch Colony SHO Mohammed Naeem Rajput said a bullet riddled body with torture marks was recovered from a house in Sector-B near Shalimar Bakery. The police suspected some personal enmity behind the murder.
The SHO said the victim was alone in the house when the incident occurred as his wife had been living with her parents for the last two months after developing differences with him while his teenage son was living with his uncle.
The officer added that the body was found in naked condition and it appeared that initially, the suspect(s) tortured the victim with a hammer and then shot him. 
Separately, a body with bullet marks was found near Old Sabzi Mandi on Tuesday.
PIB Colony police said that the body of an unidentified man in his mid-40s was found wrapped up in a blanket from a garbage dump. He was killed by firing. The corpse was shifted to the Dr Ruth Pfau Civil Hospital Karachi for medico-legal formalities and to ascertain his identity.
Meanwhile, the police on Tuesday claimed to have conducted a raid in Old Golimar, arrested two suspected gangsters and recovered a huge quantity of heroin, ‘ice’ and crystal worth millions of rupees from their custody.
Published in Dawn, February 28th, 2024
",https://www.dawn.com/news/1817649/robbers-kill-passer-by-in-new-karachi,karachi,2024-02-28
11,"Rallies held across Sindh against ‘massive rigging’, ‘stolen mandate’",LARKANA: Protest demonstrations and rallies were held in almost all district headquarters as well as smaller cities...,"LARKANA: Protest demonstrations and rallies were held in almost all district headquarters as well as smaller cities and towns of the interior of Sindh on Tuesday against, what is alleged by all opposition parties, “blatant massive rigging” in the February 8 general elections.
The protests were oranised and led by leaders of Grand Democratic Alliance (GDA), Jamaat-i-Islami (JI), Jamiat Ulema-i-Islam-Fazl (JUI-F), Sindh United Party, National Peoples Party (NPP) and other allied parties.
Speaking to participants at different rallies, the leaders strongly condemned the alleged rigging to “thrust plunderers of national wealth rejected by the masses upon the people of Pakistan”. They also condemned violent police action against participants of a recent demonstration outside the Sindh Assembly building in Karachi.
Most of the speakers at the appeared to be the candidates who had won their National Assembly or Sindh Assembly seats as per the form 45 with a big margin but declared losers in the belatedly released form 47.
In Larkana city, the JUI-F and JI took out a joint rally from Fish Market to the local press club where Maulana Mohammed Ilyas Channa, Raja Shaikh and Dr Mazhar Mughal addressed the participants, who were raising slogans and displaying banners and placards inscribed with slogans against “dacoity on public mandate”.
They deplored that the Feb 8 elections in Sindh were stolen by the Pakistan Peoples Party by using state machinery and funds.
They condemned baton charge and teargas shelling on peaceful protesters in Karachi. Even women protesters were dragged, beaten up and stuffed in police vans during a crackdown on the protesters, they deplored.
The speakers criticised 15-year rule of PPP in Sindh, and said corruption had crept into all departments and citizens’ rights were snatched away. They demanded release of all those arrested during the protests against “massively rigged elections. Otherwise, a province-wide shutterdown strike call would be given, they warned.
SUP’s Larkana leadership also organised a rally which was taken out from the State Life Insurance road and passed through various roads and streets. Addressing the protesters, SUP leaders told the participants and the media that they rejected the Feb 8 election results that were blatantly changed in favour of defeated leadership and other candidates of Pakistan Muslim League-Nawaz and PPP.
An impressive rally was organised jointly by JUI-F and GDA leaders from the Arror area covering various roads and streets of Rohri to condemn alleged theft of public mandate across the country and police excess against opposition supporters in Karachi.
Maulana Mohammad Saleh Indhar, Faqeer Inayat Buriro, Mufti Saud Afzal Halejvi, Faqeer Kamal, Arbaz Abbasi, Hafiz Abdul Hameed Mahar, Qari Liaquat Ali Mughal and others addressed the protesters.
They said they had taken out the rally and observed a ‘black day’ against the massive rigging and excesses on peaceful protesters in Karachi.
They demanded that the Election Commission of Pakistan hold fresh general elections.
In Jacobabad, a procession against “changed election results” was taken out from the district office. The participants held a demonstration and sit-in outside the local press club.
The protest was led by Dr A.G. Ansari, Maula Bakhsh Khoso, Sardar Bakhsh Mangrio, Faqeer Abdul Rasool, Maulana Abdul Jabbar Rind and others.
Similar protests were held in different cities and towns of Shaheed Banazirabad, Naushahro Feroze and Sanghar districts. GDA, JUI-F, PML-F and SUP leaders, workers and supporters marched through the streets of Nawabshah after setting off from Sakrand road and before assembling outside the city’s press club to hold a noisy demonstration. JI leaders and activists also joined in the protesters, who were carrying banners and placards as well as flags of GDA and their respective parties.
Addressing the participants, Zakir Hussain Jamali of JUI-F, Gul Hasan Rind of SUP, Ghulam Mustafa Jamali of PML-F, Suroor Ahmed Qureshi of (JI), Comrade Ali Jan Rind of the National Peoples Party and other leaders condemned the alleged massive rigging in the Feb 8 general elections.
GDA and allied parties also held rallies in Naushahro Feroze city and Moro town. Speaking to protesters, Khan Soomro, Qayoom Memon, Aslam Korejo, Fakeer Ghulam Jaan Dahiri, Maulana Abdul Rehman Dangraj, Irshad Saand and others condemned the police action against GDA protesters in Karachi and implication of NPP Chairman Ghulam Murtaza Jatoi and other activists in false terrorism cases.
Other towns were such rallies were taken out included Sanghar, Shahpur Chakar and Khipro. Tariq Leghari, Maulvi Mohammed Hassan, Maulvi Ameer Bux Marri and others spoke to the participants outside Sanghar Press Club.
They expressed their outrage over police action in which, they claimed, JUI-F leader Rashid Mehmood Soomro, who had defeated PPP Chairman Bilawal Bhutto-Zardari but was declared loser, was also injured along with other protesters.
In Dadu, a large number of GDA activists held a protest rally and marched through various roads before holding a demonstration outside the local press club. They were led by Sardar Ashiq Ali Zounr and Mumtaz Ali Zounr. The leaders called for fresh elections claiming that rigging on a large scale had been committed in all those constituencies where PML-N and its PDM allies, as well as PPP were facing a humiliating defeat as per the counting till midnight after polling on Feb 8. A fresh and fair election would be in the later interest of the country and nation, they said.
Meanwhile, the protesters blocked Indus Highway at railway crossing in Dadu to disrupt flow of vehicular traffic to various towns. They were led by local GDA leaders Ijaz Soomro, Maqsood Jjatial, Khalid Lashari and Sultan Ahmed Mangi.
In Badin, GDA, PTI, JI, JUI-F and SUP supporters observed a ‘black day’ against poll rigging and held a protest demonstration in front of the local press club. They were led by Syed Mardan Ali Shah, Ghulam Rasool Memon, Mohammad Ismail Khaskeli, Ameer Azad Panhwar. The protesters were wearing black armbands and raising slogans against caretaker government. Election commission and police.
Speaking to the media, they alleged that Most DROs and ROs changed the results after accepting offers of millions of rupees for the same.
In Matli also, a large number of JUI-F workers led by Maulana Gul Hassan Zounr and others, held a rally from Qasmia Madressah to the local press club.
In Umerkot, a rally against alleged rigging was taken out from Jinnah Park to the local press club. It was led by a PS-50 candidate, Faqir Ghulam Nabi Mangrio and a PS-49 candidate Khizer Hayat Mangrio. The protesters also observed a sit-in at Allahwala Chowk against “rigged elections and changed results”.
Addressing the protesters, they condemned that once again electorates were insulted on Feb 8 powers were given to those “who had been looting Sindh for 15 years and, therefore, rejected by the masses”.
A large number of GDA, PTI, JI, JUI-F and SUP activists took part in the rally.
Published in Dawn, February 28th, 2024
",https://www.dawn.com/news/1817644/rallies-held-across-sindh-against-massive-rigging-stolen-mandate,karachi,2024-02-28
12,Larkana judge withdraws resignation,"KARACHI: Larkana  district and sessions judge , Syed Sharafuddin Shah, withdrew his resignation after appearing...","KARACHI: Larkana  district and sessions judge , Syed Sharafuddin Shah, withdrew his resignation after appearing before the Chief Justice of Sindh High Court on Tuesday. 
According to a statement issued by the registrar of SHC on Tuesday, on receipt of the resignation, which was all over social as well as electronic and print media, through email, it was placed before the chief justice Aqeel Ahmed Abbasi, who then heard Mr Shah.
“He has conceded his abrupt decision of tendering resignation and has therefore withdrawn the same. 
During the hearing, it came to light that the core issue was misunderstanding and miscommunication [created] by lower staff,” it said. 
However, the issue now stood resolved after voluntary withdrawal of the resignation by the judge. 
“All the misconceptions and misunderstandings in this regard may be clarified,” it concluded.
The judge had tendered the resignation on Feb 23 citing various incidents that he had described as “humiliation”.
Published in Dawn, February 28th, 2024
",https://www.dawn.com/news/1817641/larkana-judge-withdraws-resignation,karachi,2024-02-28
13,Hindus protest repeated thefts in temple,MIRPURKHAS: Scores of people of minority Hindu community staged a demonstration outside press club on Tuesday in...,"MIRPURKHAS: Scores of people of minority Hindu community staged a demonstration outside press club on Tuesday in Jhuddo in protest against police failure to arrest an audacious gang of thieves who, they said, had thrice committed theft in Shiv Mahadev temple over past one and a half month.
The protesters carrying banners and placards raised slogans against police and complained to media persons that they had reported to police that an unknown gang thieves had thrice committed theft after breaking open locks on the temple and taken away gold ornaments, valuables and antique items. 
They had made several complaints but police had not taken notice of the crime so far, they said. 
They demanded Mirpurkhas DIG and SSP ensure the stolen temple property was recovered, the culprits were arrested immediately and awarded exemplary punishment.
Published in Dawn, February 28th, 2024
",https://www.dawn.com/news/1817639/hindus-protest-repeated-thefts-in-temple,karachi,2024-02-28
14,Bidding for lining of K.B. Feeder canal  to be held afresh on March 20,HYDERABAD: The International Competitive Bidding (ICB) for the lining of Kalri Baghar Feeder Upper will now be held...,"HYDERABAD: The International Competitive Bidding (ICB) for the lining of Kalri Baghar Feeder Upper will now be held on March 20. The process was cancelled earlier following anomalies pointed out by irrigation secretary last year. 
National and international firms would apply for the contract through bidding on March 20 for which notice inviting tender (NIT) had already appeared in newspapers.
K.B. feeder is the only right bank canal of Kotri Barrage that feeds Keenjhar Lake, which then supplies water to provincial capital. The federal government had approved the lining scheme at a cost of around Rs41bn in 2021 as the project was to meet water needs of Greater Karachi Bulk Water Supply Scheme, commonly referred to as K-IV.
As per NIT, the contract had three major packages, including cement concrete lining of K.B. upper from RD 0+000 to 65+000 and its allied works at a cost of Rs8265m; from RD 65+000 to 130+000 at a cost of Rs9,757m; RD130+000 to 189+000 at a cost of Rs9,913m.
The international bidder would have to enter into a joint venture with a Pakistani firm in accordance with relevant provisions of the Pakistan Engineering Council (PEC) bylaws. The bids would be opened in the project director’s office. The Sindh government has appointed Mukhtiar Ahmed Abro as project director.
The project was hit by irregularities and not only irrigation secretary but then caretaker law minister also intervened to get the process stopped and subsequently, the bids were cancelled by secretary Niaz Abbasi and Kotri Barrage chief engineer Haji Khan Jamali was issued a show-cause notice.
The Feeder’s lining is part of larger K-IV project for ensuring a dependable supply of around 650 million gallons per day (MGD) to Karachi from the Keenjhar Lake in Thatta. 
The K-IV is being executed by Wapda and its phase-I is supposed to be completed in October this year. With phase-I’s execution, Karachi would be getting 260 MGD from the lake.
K.B. Feeder is a perennial canal that covers an area of around 38 miles and the lining scheme was approved by Ecnec after Sindh government decided to execute it for saving water to meet Karachi’s future needs. 
As per initial plan, the lining scheme is to be executed on 50:50 basis by federal and Sindh governments. The provincial government had allowed national competitive bidding (NCB) on Oct 16, 2023, with some conditions following a request by then CE Kotri Barrage Haji Khan Jamali but it was hit by irregularities, prompting then caretaker law minister Umer Soomro being chairman of Sindh Public Procurement Regulatory Authority to raise the matter with irrigation secretary on Dec 20. 
The secretary got the bidding process stopped and decided to get it done afresh.
The canal’s lining would save around 500 cusecs of water initially in phase-I. Presently, Karachi was being provided 1200 cusecs from Kotri barrage through the canal, more than double the allocated share of 520 cusecs for Karachi.
Published in Dawn, February 28th, 2024
",https://www.dawn.com/news/1817637/bidding-for-lining-of-kb-feeder-canal-to-be-held-afresh-on-march-20,karachi,2024-02-28
15,"IT’s integration in agriculture will enhance productivity, says VC",HYDERABAD: Sindh Agriculture University’s vice chancellor Dr Fatah Marri has said that IT’s integration in...,"HYDERABAD: Sindh Agriculture University’s vice chancellor Dr Fatah Marri has said that IT’s integration in agriculture would not only enhance productivity but also create new opportunities, especially for women in agri-business and related fields.
He said at inauguration ceremony of an IT exhibition organised by the university’s Information Technology Centre in Tandojam on Tuesday that the role of IT across various sectors particularly agriculture was indispensable.
The exhibition was jointly inaugurated by the VC, Sindh information secretary Nadeemur Rehman Memon and provincial secretary for planning Asghar Ali Memon. 
The exhibition showcased a diverse array of software, applications and models developed by final year students. Private companies based in Karachi and Hyderabad also participated in the event and offered internship and employment opportunities to the university’s IT graduates.
He said that extraordinarily rapid development in the world since 1991 can be attributed to the revolutionary impact of Artificial Intelligence. 
Highlighting transformative potential of IT’s integration in agriculture, the VC predicted it would not only enhance productivity but create new opportunities, especially for women, in agri-business and related fields. 
He underscored significance of software, models, and applications developed by university’s graduates, emphasizing their importance in meeting demands of agriculture-based and agri-tech industries.
The IT secretary highlighted significant progress made by IT sector, stating its vital role in the development of various sectors, including Information Technology, medical, agriculture, engineering, livestock, manufacturing, and marketing. 
He said that “with the help of IT, agricultural products’ exports and access to global markets can increase Pakistan’s GDP.”
The planning secretary encouraged youth to start IT-based businesses, emphasising the need for focusing on IT-related projects. Importance of relationship between the industry and the academia in commercialising models and software had been showcased in the exhibition, he said.
Dean Dr Aijaz Ali Khooharo, Dr. Mir Sajjad Talpur, Dr Mohammad Ismail Khumbhar, Dr Mohammad Yaqoob Koondhar and others highlighted how IT had transformed global economic and business activities in recent decades. 
They talked about promising development of rural women’s participation in education, IT, agricultural development and domestic industries in Sindh.
The event was attended by faculty, students and industry representatives, who showcased 38 projects encompassing a wide range of applications, including health, agriculture, monitoring systems, artificial intelligence, and more. Successful projects were awarded shields, signifying contribution to technological innovation and societal progress.
Published in Dawn, February 28th, 2024
",https://www.dawn.com/news/1817633/its-integration-in-agriculture-will-enhance-productivity-says-vc,karachi,2024-02-28
