,Header,Summary,Detail,Link,Category,CreationDate
11,Spring plantation drive kicks off in Lower Dir,LOWER DIR: The district administration launched the spring plantation drive in Lower Dir on Tuesday. Deputy...,"LOWER DIR: The district administration launched the spring plantation drive in Lower Dir on Tuesday.
Deputy commissioner Wasil Khan along with divisional forest officer Shahid Noor Khattak, sub-divisional forest officer Muqaid Khan and other officials kicked off the campaign during a function in Balambat area.
On the occasion, Mr Wasil said 75,000 saplings would be planted during the drive. He directed the forest and environment departments to involve farmers, social activists and volunteers in making the drive a success. 
He said awareness sessions regarding tree plantation and its importance would also be organised in educational institutions.
The DC said evergreen saplings would also be planted at offices, schools, colleges, sport grounds and barren hilly areas. 
He also asked people to play their active role in preservation of forests.
FOUND DEAD: Body of a 60-year-old man, identified as Mohammad Ghani, a resident of Ouch Gharbi, was retrieved from the River Swat in Pul Chowky area of Chakdara on Tuesday, residents and police said.
They said the man had been missing for last three days. 
The residents said the deceased was a daily wager. 
The Chakdara police registered a case and started investigations. 
PROMOTIONS: President of senior secondary schoolteachers’ association, Lower Dir chapter, Ikram Khan has claimed the director education department has promised to prepare working papers for teachers’ promotion to the posts of subject specialists and headmasters.
Speaking at a meeting here on Tuesday, he said provincial leaders of the association had met Syeda Samina Altaf in Peshawar regarding the promotions. He said Ms Altaf assured the delegation that working papers for the SSTs’ promotion would be prepared soon.
He said they informed the education director that an additional director was deliberately delaying their promotions for unknown reasons.
Published in Dawn, February 28th, 2024
",https://www.dawn.com/news/1817603/spring-plantation-drive-kicks-off-in-lower-dir,peshawar,2024-02-28
12,Fazl says his party not interested in PA opposition leader’s slot,Insists the ‘system’ will collapse.,"PESHAWAR: Jamiat Ulema-i-Islam-Fazl chief Maulana Fazlur Rehman on Tuesday said his party would neither become part of any government nor was it interested in the opposition leader’s position in the Khyber Pakhtunkhwa Assembly.
Talking to reporters at the JUI-F’s headquarters here after the meeting of the party’s provincial leadership, Mr Fazl said his party didn’t want to join the government.
“It is our principled stance that we will not become part of any government,” he said.
The JUI-F leader also said his party was not interested in the opposition leader’s position in the KP Assembly.
He said his party would stay away from the presidential polls as well.

Insists the ‘system’ will collapse

“We have not been pushed out of the system, and rather, we have decided to stay out of it,” he said.
Mr Fazl said his party didn’t want to “see politicians rely” on the security establishment.
He, however, said the establishment wielded authority and was determined to see both assemblies and their members of their own choosing.
The JUI-F chief added that the establishment was even asking political parties to field particular candidates for key slots.
He said parliament should represent the people and not the establishment.
Mr Fazl said the upcoming government won’t be able to steer the country out of crises.
“This system will collapse,” he said.
The JUI-F leader said his party had fought for the country, but the establishment treated it badly.
“The establishment is to blame for rigging in the Feb 8 general elections,” he said.
Mr Fazl said if polls weren’t rigged, then what happened to the “May 9 narrative” and that the powers-that-be should acknowledge that the nation had voted for a “rebel.”
When asked about the JUI-F’s disassociation from parliamentary politics, he said only the party’s central general council had the powers to make such a decision.
The JUI-F chief said views of the party’s all four provincial chapters would be placed before the general council in its next meeting.
To another question, he said it was not wise to involve the International Monetary Fund in Pakistan’s every issue, as the way the global lender had handled the country so far was not good.
Regarding his party’s engagement with the Pakistan Tehreek-i-Insaf, Mr Fazl said he welcomed the PTI’s move.
“We have differences about them [PTI] and have reservations regarding their agenda and ways. We both have many obstacles to overcome,” he said.
He said whenever a political force showed willingness to address the other’s reservations, dialogue took place.
“There is a long way to go before we [JUI-F and PTI] resolve our differences, but it is a good beginning, “he said.
Mr Fazl said he never liked to see politicians go to jail.
He claimed that the people did not subscribe to the notion that voters had rejected his party.
“We know our strength,” he said.
Without naming names, he said those having issues with his party’s Islamic credentials did not want to see its members in large numbers in assemblies.
The JUI-F leader insisted that the establishment and the ruling elite were opposed to the introduction of Islamic laws in the country.
He said his party helped spread anti-Americanism in the region after 9/11, and therefore, world forces were not interested in seeing its members go to assemblies.
Mr Fazl also claimed that his role in brokering peace between Pakistan and the Afghan Taliban didn’t sit well with the West.
Published in Dawn, February 28th, 2024
",https://www.dawn.com/news/1817624/fazl-says-his-party-not-interested-in-pa-opposition-leaders-slot,peshawar,2024-02-28
13,Five die as  bus falls into Haripur gorge,A DSP told Dawn that a passenger bus going to Kohala from Rawalpindi skidded off the road and fell into a ravine near Bagran Sarbaroot village.,"HARIPUR: Five passengers were killed and 19 injured when a bus fell into a gorge in Khanpur tehsil here on Tuesday. The accident occurred on a hilly road some 20 kilometres from tehsil headquarters, police and district administration officials said.
DSP Khanpur Mohammad Uzair Khan told Dawn that a passenger bus going to Kohala from Rawalpindi skidded off the road and fell into a ravine near Bagran Sarbaroot village. Five passengers died on the spot and 19 sustained injuries.
The deceased were identified as Yasmeen Bibi, Khatoon Bibi, Gula Hasan, Mohammad Zaman and Noor Ahmed.
The villagers and police took the bodies and the injured to the roadside on their backs. The rescue workers then transported the injured to Khanpur Tehsil Headquarters Hospital. Three of the seriously injured were referred to Haripur Trauma Centre.
Meanwhile, tehsil nazim Raja Haroon Sikandar, PTI leaders Raja Shahab Sikandar and Yousuf Ayub Khan reached the hospital and enquired after the injured.
MNA-elect and PTI central leader Omar Ayub Khan also expressed grief over the death of five passengers and condoled with the bereaved families.
Published in Dawn, February 28th, 2024
",https://www.dawn.com/news/1817623/five-die-as-bus-falls-into-haripur-gorge,peshawar,2024-02-28
14,Woman arrested in Haripur for strangling minor nephew,"The motive behind the boy’s murder was a property dispute, the police said.","HARIPUR: The Ghazi tehsil police claimed to have arrested a woman along with her two accomplices for allegedly strangling her minor nephew and throwing his body into a well, officials said here on Tuesday.
They said Abdul Moeed, 8, a student of grade III, went to school on Feb 21, but didn’t get back home. The family searched for the missing boy, but could not find any clue, and informed the police.
During the preliminary investigation, the police obtained the mobile phone record of the boy’s aunt, Abida Shaheen, and interrogated her on suspicion.
The officials said the suspect disclosed that she strangled Moeed with the help of two accomplices, Waseem and Mohammad Akhtar, and then threw his body into a well of the village.
After her confession, the police recovered the body from the well and shifted it Ghazi Tehsil Headquarters Hospital for autopsy. 
A criminal case was registered against the woman and her two alleged accomplices under sections 201, 202 and 302/34 of PPC. 
The motive behind the boy’s murder was a property dispute between the two brothers – the husband of the accused woman and the boy’s father – the police said.
Published in Dawn, February 28th, 2024
",https://www.dawn.com/news/1817622/woman-arrested-in-haripur-for-strangling-minor-nephew,peshawar,2024-02-28
15,Two workers of drug company killed in Bajaur,BAJAUR: Two people associated with a medicines company were killed and a passerby was injured when unknown ...,"BAJAUR: Two people associated with a medicines company were killed and a passerby was injured when unknown assailants opened fire on them in Mamond tehsil here on Tuesday, rescuers and residents said.
They said the incident occurred on Inayat Kallay-Shagoo Road near Thani area. They said unidentified armed men attacked the company’s officials riding a motorcycle.
“The two men were coming to Khar town from Mamond tehsil,” Mohammad Saad Khan, district emergency officer of Rescue 1122, said.
He told Dawn that the deceased, identified as Imran Khan, 30, resident of Yousaf Abad area of Khar tehsil, and Farman Khan, 27, of Khazana area of Lower Dir district, died on the spot after receiving multiple bullet injuries. He added a 26-year-old passerby, Mohammad Talha, was critically injured in the attack.
He said bodies and the injured were taken to the District Headquarters Hospital, Khar. Later, the bodies were dispatched to Yousaf Abad area, where their funeral prayers were offered on Tuesday evening.
Residents said they reached the attack site after hearing the gunshots, but the attackers had already fled. 
Residents and friends said both the victims had no enmity with any one, and were associated with a medicines firm as medical representatives.
Meanwhile, a police official told Dawn that they had launched investigation into the attack. An official said a team of Umary police station visited the scene to collect evidence and statements of witnesses.
Published in Dawn, February 28th, 2024
",https://www.dawn.com/news/1817621/two-workers-of-drug-company-killed-in-bajaur,peshawar,2024-02-28
16,Wheat shortage feared in Chitral,CHITRAL: The wheat stock in warehouses of the food department in Lower Chital is said to have drastically depleted...,"CHITRAL: The wheat stock in warehouses of the food department in Lower Chital is said to have drastically depleted causing fears of acute shortage of the staple grain.
An official of the food department told Dawn on Tuesday that the main warehouse of the department had a stock of just 2,000 bags (each 100kg) and about 1,000 bags in different godowns across the district, bringing the total to 3,000.
He said that in the absence of replenishment for last two months, a grave situation had arisen as fresh arrivals were expected by the next month.
During a session of the Chitral tehsil council last week, chairmen of different village councils had taken up the issue of wheat shortage, and expressed their apprehensions over an imminent ‘famine-like situation’ in the district.
Meanwhile, speakers at a consultative workshop on ‘disability-inclusive disaster risk reduction’ held here the other day demanded that specific needs of the disabled persons should be given due weight while planning disaster risk reduction. 
Held under the aegis of National Integrated Development Association (Nida), the participants said Chitral was highly prone to natural disasters triggered by climate change, thus increasing the urgency of the matter.
They said due to rampant poverty in the area and lack of healthcare facilities, the number of disabled persons was also on the rise, but they had been neglected in formulation of disaster risk reduction plans.
The speakers included Anwar Baig, Atif Sheikh and Rustam Sheraz representing Nida, while officers of the line departments and representatives of stakeholders were also in attendance.
Published in Dawn, February 28th, 2024
",https://www.dawn.com/news/1817620/wheat-shortage-feared-in-chitral,peshawar,2024-02-28
17,Play staged in Peshawar to motivate students for meeting future challenges,The stage play titled ‘Imtehan’ was written by late Prof Mohammad Azam in early 60s during his student life.,"PESHAWAR: A Pashto play was staged here on Tuesday to raise awareness among students to focus on their set targets towards facing future challenges and never get involved in unhealthy activities on the campus.
The stage play titled ‘Imtehan’ was written by late Prof Mohammad Azam Azam in early 60s during his student life.
The modern version of the play was directed by former PTV producer Masood Ahmad Shah. It was staged at Agha Khan Auditorium, University of Peshawar, under the auspices of Niaz Adabi Sangar (NAS) in collaboration with Dosti Welfare Organisation as part of its thirrd edition of 11-day Peshawar Literature Festival ( PLF).
A large number of students, teachers and visitors watched the stage play. Around nine students performed in the live stage play and earned a thunderous applause from the audience.
Shazia Rehan, a student of English department, told this scribe that the hour-long live performance was filled with clandestine humour blended in high seriousness of boarding student life.
Prof Aseer Mangal, chairman of NAS, on the occasion said that the play being relevant was staged for raising awareness among students to devote themselves to achieving their desired career goals and avoid idle activities on the campus. He added that university campuses served as the seat of learning alongside grooming up youth for future social and political challenges.
Masood Ahmad Shah said that the script of the play carried a significant message for youth and therefore, the performance registered a wholesome impact on tasteful audience. He said that such live theatrical performances should be encouraged on campus.
Jalaludin Mamoond, a student from Bajaur tribal district, who played a role in the play, stated that its central theme revolved around purposeful use of time and its wastage led to disastrous end as most students residing in the hostels away from their parents’ eyes spent their precious time in pointless things on the campus.
Prof Gulzar Jalal Yousafzai remarked that late Prof Azam being a renowned playwright knew the psyche of students and parents’ expectations, therefore, organisers selected it from a collection of his personal essays and adapted for live stage performance.
“I strongly believe such live plays, if encouraged, will help to instil a spirit of future vision among youth. Mr Shah and young performers did perfect justice to the show,” he said.
Published in Dawn, February 28th, 2024
",https://www.dawn.com/news/1817602/play-staged-in-peshawar-to-motivate-students-for-meeting-future-challenges,peshawar,2024-02-28
