,Header,Summary,Detail,Link,Category,CreationDate
9,Release of seven inmates ordered,"ABBOTTABAD: Following the directives of Chief Justice Peshawar High Court Justice Mohammad Ibrahim Khan, District ...","ABBOTTABAD: Following the directives of Chief Justice Peshawar High Court Justice Mohammad Ibrahim Khan, District and Session Judge Ikhtiyaar Khan and Judicial Magistrate 1st Abbottabad Gul Mohammad Tuesday conducted a visit to the Abbottabad District Jail.
Their visit was aimed at overseeing the proceedings and addressing matters concerning prisoners ahead of Eidul Fitr.
During their inspection, the judicial officials ordered the release of seven inmates who were implicated in diverse criminal activities. Furthermore, they listened to the grievances of other detainees and promptly issued instructions for the resolution of their concerns.
This action underscores the judiciary’s commitment to ensuring justice and facilitating the observance of religious festivities among the incarcerated people.
Published in Dawn, April 10th, 2024
",https://www.dawn.com/news/1826849/release-of-seven-inmates-ordered,peshawar,2024-04-10
10,Four thieves held with Rs5.3m stolen money in Swabi,SWABI: The Swabi police have arrested four thieves in connection with Rs5.7 million theft committed at an exchange...,"SWABI: The Swabi police have arrested four thieves in connection with Rs5.7 million theft committed at an exchange company here last month.
Addressing a press conference, SP investigations Khankhel said the thieves were traced through footage of CCTV cameras.
He said Amanullah and Nasir Khan belonged to Peshawar, Hazrat Ali Nowshera and Amjad Ali was from Buner.
He said a week before the robbery one of the accused, Amanullah had visited the market where the exchange company was located. He said the police recovered Rs5.3 million cash and two pistols from the accused.
Meanwhile, the police claim a man, who is in jail in a case, got his father killed through hired assassins.
Addressing a press conference, DSP Jawad Khan said on March 18, a complainant, Zain Muhammad, a resident of Kalabat, had filed a report with the Topi police station, stating that unknown men had shot dead Said Mohammad, also a resident of Kalabat, inside a mosque during morning prayers.
He said a team led by SP investigations Khankhel Khan was formed, which used modern technology to reach the culprits.
He said Sabir Khan, a son of the deceased, who is in jail in a case, paid Rs0.6 million to hired people for murdering his father.
DSP Jawad said Sabir hired killers, Shahab Khan and Haroon Khan through Osama Khan and Mirwas Khan, who completed the task.
He said Osama and Sabir were already in jail, the police had also arrested Shahab and Mirwas, while efforts were on to arrest Haroon.
Published in Dawn, April 10th, 2024
",https://www.dawn.com/news/1826848/four-thieves-held-with-rs53m-stolen-money-in-swabi,peshawar,2024-04-10
11,Traditional caps go like hot cakes in Khyber for Eid,"KHYBER: The Landi Kotal Bazaar has reported high sales of traditional caps, which are worn by residents with Eid...","

A young customer tries a cap at a shop in Landi Kotal Bazaar. — Dawn

 
KHYBER: The Landi Kotal Bazaar has reported high sales of traditional caps, which are worn by residents with Eid clothes.
Sellers offer a variety of caps with varying prices to customers, mostly youth and children, while elders prefer those with modest designs.
Iqbal Khan, a cap seller in Landi Kotal Bazaar, told Dawn that his sales had multiplied as Eidul Fitr drew closer.
“Parents and children consider their Eid preparations incomplete without new caps,” he said.
He said he sold caps from Bangladesh, China, Karachi, Dir, Charsadda, and Peshawar, but the youth preferred white ones from Charsadda and Peshawar.
“People mostly buy colourful caps for their children aged below 15,” he said.
The shopkeeper said handmade white caps from Dir were mostly liked by tribesmen over the age of 40.
He said handmade caps cost more than others.
“Bangladeshi, Chinese and Peshawari caps liked by youth because they’re lightweight, mostly machine-made, and have affordable prices,” he said.
Javed Khan, 24, said he inherited the cap business from his father, who migrated to Landi Kotal from Bajaur in 2002.
“My business picks up momentum days ahead of Eidul Fitr and Eidul Azha. In other months, it is business as usual for me,” he said.
The shopkeeper said the caps made in Wahid Garhi and Bakhshu Pul areas of Peshawar had become popular with the youth due to their light weight and fine finishing.
“Wearing a cap is our tradition. Any festive occasion is considered incomplete without the addition of a new cap to the youth’s wardrobe,” he said.
Mr Javed, however, regretted that the demand for traditional handmade white caps from Dir was gradually declining due to the “influx” of both imported and lightweight caps with colour and design variations.
People in Jamrud and Bara areas of Khyber tribal district said the demand for caps in the two tehsils was not as high as it was in Landi Kotal.
They said the tradition of wearing caps was fast fading away, with only the elderly strictly following it.
During its ‘occupation’ of Bara tehsil from 2005 to 2011, a local militant organisation, Lashkar-i-Islam, had made it mandatory for men to wear caps. However, the restriction eased after the 2012 elimination of the outfit in a military operation.
Turab Ali, a social activist, insisted that as tribal traditions were fast losing their appeal for local youth, they mostly wore caps or lungi to weddings and cultural events only.
Sajid Ali Kukikhel of Jamrud said tribal youth were more influenced by new fashion trends, while some among them insisted that caps “ruined” their hairstyles.
“Now, caps are mostly worn by youngsters for offering prayers. However, elders put on caps as a tradition,” he said.
Published in Dawn, April 10th, 2024
",https://www.dawn.com/news/1826847/traditional-caps-go-like-hot-cakes-in-khyber-for-eid,peshawar,2024-04-10
12,Speeding car kills two pedestrians in Kohat,"The deceased were identified as Khayal Khan and Mohammad Jameel, residents of Shaheed Banda area.","KOHAT: A speeding car killed two pedestrians on the Indus highway in Dhodha Square here on Tuesday.
The deceased were identified as Khayal Khan and Mohammad Jameel, residents of Shaheed Banda area. The police took the bodies to the KDA Teaching Hospital for postmortem.
A police official said the driver of the car sped away. He added the police were making efforts to arrest him.
Meanwhile, deputy commissioner Dr Azmatullah Wazir on Tuesday issued a stern warning that those indulging in festive firing on Chand Raat and Eid days would spend their Eid in the jail.
Chairing a meeting here, he also appealed to the people to spend the money wasted on bullets on the welfare of poor.
Tehsil municipal officers, officials of the police, health and Water and Sanitation Services Company attended the meeting. The participants termed festive firing a cognisable offense because it could take a life or render any person disabled for life.
The deputy commissioner also directed keeping the roads, streets, surroundings of mosques and bazaars clean during Eid days.
POWER, GAS OUTAGES: The consumers complained on Tuesday that they continued to suffer power and gas outages throughout Ramazan despite promises of smooth supply.
Chairman of Grand Businessmen Alliance Haji Abid Khan and chief of Kohat Muttahida Tajir Ittehad Ameer Khan Afridi lamented that the service providers had no regard for the holy month of Ramazan.
Chairman of association of CNG stations, southern Khyber Pakhtunkhwa, Haji Sajid regretted that power loadshedding was being carried out from 6am to 10am and then from 2pm to 5pm in the Kohat city.
He said the situation was worse in the rural areas.
However, Peshawar Electric Supply Company executive engineer said the areas where the people didn’t pay the bills were subjected to long power suspension.
Published in Dawn, April 10th, 2024
",https://www.dawn.com/news/1826846/speeding-car-kills-two-pedestrians-in-kohat,peshawar,2024-04-10
13,Bannu police arrest two over murder of young man,LAKKI MARWAT: The Bannu police claimed to have solved a blind murder case by arresting two suspects during a raid on...,"LAKKI MARWAT: The Bannu police claimed to have solved a blind murder case by arresting two suspects during a raid on Tuesday.
A police official said the city police had recovered the body of a young man from fields on April 4. He said the deceased was identified as Kabeer. “Unknown assailants had dumped his body in the fields after shooting him dead.”
He said a team headed by DSP Imran Aslam traced and reached the murderers by using modern technology and human intelligence. He said Munibur Rehman and Hikmatullah were friends of Kabeer and had taken a loan from him. “When Kabeer asked for return of loan, Munib with the help of Hikmat shot him dead,” the official said.
CHEQUES DISTRIBUTED: Provincial minister for public health Malik Pakhtoonyar Khan and deputy commissioner Shah Saud distributed cheques among deserving families in Bannu on Tuesday.
A total of 4,000 families received cheques of Rs10,000 each under the Eid package announced by Khyber Pakhtunkhwa Chief Minister Ali Amin Gandapur.
Speaking on the occasion, the minister said provision of financial help would enable poor people to celebrate Eid with joy.
DAM CONSTRUCTION: The leaders of Bannu Bachao Tehreek and Bannu Qaumi Mahaz have vowed to continue struggle to save thousands of kanals of land from becoming barren as a result of construction of Kurram Tangi dam.
Talking to reporters on Tuesday, the bodies’ heads Pir Syed Qaisar Abbas Shah and Irfan Pirzada Advocate said around 56,000 kanals land wasn’t made part of the project, thus depriving it of irrigation water. They said relevant authorities had promised making this land part of the dam, but to no avail.
Published in Dawn, April 10th, 2024
",https://www.dawn.com/news/1826845/bannu-police-arrest-two-over-murder-of-young-man,peshawar,2024-04-10
14,District status demanded for Tanawal,MANSEHRA: People of Pulrah and adjoining areas on Tuesday demanded of the government to notify Tanawal as a separate...,"MANSEHRA: People of Pulrah and adjoining areas on Tuesday demanded of the government to notify Tanawal as a separate district.
Resident Riaz Ahmad Tanoli told reporters that people of Tanawal settled in Mansehra, Abbottabad, and Haripur districts were fighting for their rights.
“The government should honour our peaceful struggle for rights and declare Tanawal a separate district of the Hazara division,” he said.
Another resident, Abdul Razzaq, said Tanawal lacked basic facilities and development. “People of the erstwhile Amb and Pulrah states have been peacefully advocating the cause of Tanawal district for along time. The government should notify Tanawal as a separate district,” he said.
Mr Razzaq said the residents of Tanawal were still widely deprived of their basic amenities and development. “If the government is sincere about our development, it should declare Tanawal a district,” he said.
HELD: The police have claimed to have arrested around 100 drug peddlers and seized a large cache of narcotics across Mansehra district last week.
“We launched a crackdown on narcotics earlier this month and have so far arrested around 100 drug pushers and seized around 120kg of charas, 6kg of ice drug and 2kg of heroin,” DPO Shafeeullah Gandapur told reporters here on Tuesday.
Published in Dawn, April 10th, 2024
",https://www.dawn.com/news/1826844/district-status-demanded-for-tanawal,peshawar,2024-04-10
