,Header,Summary,Detail,Link,Category,CreationDate
8,Govt urged to increase clerics’ honorarium,LOWER DIR: The religious political parties and other organisations on Thursday demanded of the Khyber Pakhtunkhwa...,"LOWER DIR: The religious political parties and other organisations on Thursday demanded of the Khyber Pakhtunkhwa government and its department concerned to increase the honorarium of imams of mosques and its payment should be ensured every month.
Speaking at a news conference at Chakdara Press Club, Maulana Ubaidullah Anwar of Pakistan Rah-i-Haq Party, Maulana Abdul Razaq of Jamaat-i-Islami, Maulana Ubaidullah of Ishaat Tauheed wa Sunnah, Dr Sultanuddin of Jamaat Ahl-i-Hadees, Maulana Shah-i-Room of JUI-F and others said that the previous government had taken a good step by announcing honorarium for the mosque imams.
They said there were reports that the honorarium was being stopped by the current caretaker provincial government. They argued that the honorarium given to the scholars and imams of mosques should be increased and its payment be ensured every month not through crossed cheques but the amount should be sent to their accounts directly.
They also demanded of the government to include the rest of the imams in the scheme so that they could perform their religious duties with “utmost sincerity and devotion”. 
Published in Dawn, May 12th, 2023
",https://www.dawn.com/news/1752438/govt-urged-to-increase-clerics-honorarium,peshawar,2023-05-12
9,Court seeks ECP’s response to plea for replacement of governor,Bench orders to club petition with that of PTI challenging delay in polls,"PESHAWAR: The Peshawar High Court on Thursday sought response of Election Commission of Pakistan (ECP) to a plea seeking declaration that the Khyber Pakhtunkhwa governor had violated his oath of office by not giving date for general elections to the provincial assembly within 90 days of its dissolution so he should be replaced by the President of Pakistan with an acting governor.
A bench consisting of PHC Chief Justice Musarrat Hilali and Justice Shakeel Ahmad issued the order after preliminary hearing of a petition filed by Advocate Mohammad Muazzam Butt, affiliated with Pakistan Tehreek-i-Insaf. The petitioner has requested the high court to order the provincial caretaker government to vacate their offices as rendering the continuation of such government beyond 90 days is nullity in law and without jurisdiction.
The bench also ordered that the present petition should be clubbed with a petition of PTI, challenging delay in holding of general elections to KP Assembly.
Muazzam Butt contended that on failure of the governor in the performance of his functions under the Constitution, he was no longer entitled to exercise the power of fixing election date beyond the prescribed period of 90 days and likewise ECP would also not be bound to seek the poll date from him.

Bench orders to club petition with that of PTI challenging delay in polls

He also requested the court to issue directives to the federal interior ministry to consider the “conduct and guilt” of the governor in breach of his constitutional responsibility at the scale of Article 6 of the Constitution, dealing with high treason, for necessary action.
The petitioner contended that the governor committed breach of his constitutional responsibility and violated his oath prescribed under 3rd Schedule read with Article 102 of the Constitution. He added that he violated fundamental rights of citizen of Khyber Pakhtunkhwa to be represented through chosen representatives within the period of 90 days since the dissolution of provincial assembly on the advice of the then chief minister.
The petitioner stated that the Supreme Court in a suo moto case in the current year observed that the governor breached his constitutional responsibility in for not fixing a date for holding general elections to the assembly of the province.
He said that since the dissolution of the assembly on January 18 more than 90 days had already passed, therefore, the life of the caretaker government had ended as such any action or in action of such government would be nullity in law.
He contended that the governor was mandated to fix the election date within 90 days since the dissolution of the assembly in the manner provided in Constitution.
An additional attorney general, Sanaullah Khan, said that the governor had already given date of October 8 for holding polls and the same was notified by ECP. He added that holding polls was responsibility of ECP and not the governor.
To a query by the bench, the AAG stated that the governor could not be replaced in such a manner. He said that an acting governor could only be appointed when the governor was either out of the country or facing health issue.
The petitioner said that the governor by not acting in obedience to the Constitution in discharge of his required function under Article 105 (3) and Article 224 (2) read with 3rd Schedule to the Constitution related to the oath of the office had in essence abrogated, attempted to abrogate the Constitution and had exposed himself to the guilt of high treason.
Published in Dawn, May 12th, 2023
",https://www.dawn.com/news/1752437/court-seeks-ecps-response-to-plea-for-replacement-of-governor,peshawar,2023-05-12
10,Dengue isolation wards to be set up in Lakki hospitals,LAKKI MARWAT: The district administration has asked the health department to set up isolation wards at Category-C...,"LAKKI MARWAT: The district administration has asked the health department to set up isolation wards at Category-C hospitals in Lakki and Naurang and carry out fumigation to prevent spread of dengue fever in the district.
An official said that Deputy Commissioner Abdul Hadi chaired a meeting at his office to discuss the dengue prevention and control plan and issued directives to line departments for its implementation.
“Mr Hadi asked the health authorities to engage polio staff in anti-dengue and anti-malaria activities and conduct awareness sessions in educational institutions,” he said. 
The official said that a total of 235 dengue cases were reported in the district last year, with Ghaznikhel tehsil having the highest number of 98 cases, followed by Lakki tehsil with 70, Naurang tehsil with 62 and Bittani subdivision with three patients.
He claimed that no confirmed dengue case was reported from any part of the district in the ongoing year. Under the dengue prevention and control plan, municipal administration would ensure covering open water tanks, cleaning sewerage lines, repair and replacement of rusted pipes, removal of garbage and regular checking of tyre shops, he added.
He said that the deputy commissioner tasked the officials of education, local government, social welfare and population welfare departments to launch awareness campaign through their employees to sensitise people about the symptoms, treatment and prevention of dengue and other mosquito-borne diseases.
The official said that a 15-bed isolation ward would be established at district headquarters hospital while the management of Category-C hospitals in Lakki and Naurang would set up six-bed and five-bed isolation wards in their respective facilities.
He said that the deputy commissioner told the meeting that administration would make efforts to prevent outbreak of dengue and other diseases.
Published in Dawn, May 12th, 2023
",https://www.dawn.com/news/1752436/dengue-isolation-wards-to-be-set-up-in-lakki-hospitals,peshawar,2023-05-12
