,Header,Summary,Detail,Link,Category,CreationDate
10,Court seeks comments to plea against ban on use of Kohat tunnel by oil tankers,The ban was imposed by NHA more than seven years ago,"PESHAWAR: Peshawar High Court has sought comments from federal government and National Highways Authority to a petition of All Pakistan Oil Tankers Owners Association, challenging the ban imposed more than seven years ago on using Kohat tunnel by oil tankers.
A bench consisting of Justice Syed Mohammad Attique Shah and Justice Syed Arshad Ali issued notices to the NHA chairman, its general manager, secretary of communication ministry and Kohat deputy commissioner, directing them to submit their comments within a fortnight.
The petition was filed on behalf of All Pakistan Oil Tankers Owners Association through its provincial chairman Mohammad Shafi Marwat, seeking directives of court for the respondents to allow oil tankers to use Kohat tunnel and also declare the impugned decision as illegal.
The petitioner has also sought interim relief, requesting the court that till final disposal of the petition the oil tankers may be allowed to use Kohat tunnel.

The ban was imposed by NHA more than seven years ago

The petitioner’s counsel, Mohammad Arif Firdous, stated that construction of the 1.9-kilometre long Kohat tunnel had begun in 1999 and it was opened to traffic in June 2003.
He said that as part of developing the Indus Highway system, the tunnel served as a shorter alternate route to that of the Kotal Pass, situated between the cities of Peshawar and Kohat. He stated that the new route decreased the time required to travel through the Kotal Pass by about 20 minutes.
The counsel said that the main advantage of Kohat tunnel was that long bodied vehicles could now use Indus Highway whereas previously the narrow turns and bends on the Kotal Pass had made it impossible for such vehicles to travel.
He stated that after its opening, the vehicles of the petitioner organisation were allowed to use Kohat tunnel till 2016 and not a single accident happened throughout that period.
However, he said that all of a sudden the respondent NHA general manager issued a letter on December 9, 2016, to the commanding officer of 23 Punjab Battalion Kohat-Dara Adamkhel, asking him not to allow use of the tunnel by oil tankers.
He contended that after the ban was imposed, the association staged protests for many days and the local administration assured it that the matter would be resolved. He added that the association time and again approached different authorities including prime minister but so far no response was given to it.
Mr Firdous argued that the petitioner vehicles had now been forced to use the 11-killometre hilly track between Kohat and Dara Adamkhel, which was perilous and caused regular accidents.
He contended that the passenger vans fitted with two or three CNG tanks were allowed to pass through the tunnel despite being potential hazardous.
He pointed out that not a single tunnel was closed to oil tankers in the country except Kohat tunnel.
He added that if the ban was according to standard operating procedure (SOP) then it should be applied across the board as presently it was discriminatory.
Published in Dawn, March 4th, 2024
",https://www.dawn.com/news/1818996/court-seeks-comments-to-plea-against-ban-on-use-of-kohat-tunnel-by-oil-tankers,peshawar,2024-03-04
11,Six including two brothers killed in Swabi firing incidents,"SWABI: Six people were killed in separate incidents of firing in Swabi district on Sunday, the police and rescue...","SWABI: Six people were killed in separate incidents of firing in Swabi district on Sunday, the police and rescue service officials said.
They said two brothers were allegedly killed by their cousin in Kotha village of Topi tehsil.
Topi city police station officials said the suspected killer opened fire on the brothers after exchanging arguments with them over a money dispute.
The deceased were identified as Sheraz Hussain and Imran Hussain, and the killer as Hassan Zia.
The bodies were taken to the Tehsil Headquarters Hospital, where the relatives waited for long for the doctors to conduct postmortem of the bodies. Later, the relatives staged a demonstration.
The police arrested Zia along with the weapon he used in the murders.
An FIR was registered against him in the Topi city police station.
Meanwhile, two brothers killed their uncle and his son and injured another in Razar tehsil over a land dispute, the police said.
Fazalur Rehman, brother of deceased, Malik Zaman and Sikandar Zaman, told the police that Mujibur Rehman and his brother, Attaur Rehman sprayed the father and his with bullets after arguing with them at Burhan Chowk in Doubian area, killing both on the spot.
The complainant said elders made several attempts to resolve the land dispute, but couldn’t prevent the bloodshed.
The Yar Hussain police registered an FIR against the brothers, and arrested Mujibur Rehman.
Separately, a man and his relative were shot dead in Parmuli village on Sunday, rescue service and police officials said.
Parmuli police officials said they reached the crime scene after getting information.
They said Pervez Khan, a brother of deceased, Wahab Ali, told them that Zahid Hussain came to the hujra of Azan Gul and opened fire, killing his relative, Sher Zaman on the spot. He said his brother, Wahab, succumbed to injuries while being shifted to hospital.
The police said cause of the murders was not known.
Published in Dawn, March 4th, 2024
",https://www.dawn.com/news/1818995/six-including-two-brothers-killed-in-swabi-firing-incidents,peshawar,2024-03-04
12,New road connects Broghil valley to rest of Chitral,CHITRAL: The residents of Broghil in Upper Chitral have said that the alternate road from Kishmanja to Pechus has...,"CHITRAL: The residents of Broghil in Upper Chitral have said that the alternate road from Kishmanja to Pechus has connected the valley to other areas.
The 32-kilometre road connected by two suspension bridges was constructed by Aga Khan Rural Support Programme under its Central Asian Poverty Programme two years ago.
The residents said that about 10 years ago, the government connected the valley with the rest of the country by constructing a jeepable track. The track passed through a long chain of hilly area, which used to remain disconnected due to rock falling, avalanches and debris that also endangered the lives of passersby, they added.
Qadam Ali, the cluster manager of 19 village organisations executing the road project, and community members Rehmat Nawaz, Sher Zaman, Faiz Mohammad and others said that the alternate road was really a ‘game changer’ for the remote valley bereft of basic amenities till recently.
They said that an all-weather road to the valley was really a dream for its dwellers. They said that the dream came true with the completion of the road project. They said that owing to limited funds, the government had not included the two bridges in its scheme and the road was aligned straight passing through the valley.
Locals said that after the closure of the road, the residents of the upper parts of the valley had to travel for more than 12 hours with the luggage on their backs or spending extra amount on paying fare for pony while the local shopkeepers also charged extra for additional expenses on transportation of items during those months.
They said that potential of agriculture and tourism remained underutilised for want of all-weather road. They said that the road would boost local economy and alleviate poverty in the area.
They said that the alternate road also connected three villages of the lower valley including Kishmanja, Pechus and Vedin Khot situated on the opposite side of the old road.
Published in Dawn, March 4th, 2024
",https://www.dawn.com/news/1818994/new-road-connects-broghil-valley-to-rest-of-chitral,peshawar,2024-03-04
13,Writers call for preservation of linguistic diversity,PESHAWAR: Speakers at a book launching ceremony stressed the need for preservation of linguistic diversity through...,"PESHAWAR: Speakers at a book launching ceremony stressed the need for preservation of linguistic diversity through several pragmatic steps so that communities speaking different languages could grow and participate in national development.
They termed the book a kaleidoscope of linguistic diversity in Chitral and sought its perseveration on state-run media outlets.
The new book in Urdu titled ‘Chitral Ki Zubanay -- Mazee, Haal, Mustaqbal’ authored by Fakhrudin Akhundzada was launched at Peshawar Press Club the other day under the banner of Anjuman Taraq-i- Khowar Halqa Peshawar.
“A monthly magazine in Khowar soon will hit bookstalls while Khowar has already been adopted as medium of instruction in schools till 8th grade. The newly published will serve as a crash course for research students,” said speakers.
Writers, poets, scholars and linguists attended the event. Addressing the function, speakers urged policymakers and academicians to take concrete steps for perseveration and promotion of all languages being spoken in Chitral valley. They added that some languages were under the threat of being extinct.
Fakhrudin Akhundzada, deputy director of Forum for Languages Initiative (FLI), on the occasion said that the book was meant to bring up some important information about linguistic diversity of his area and put forward pragmatic suggestions for saving that treasure trove for posterity.
Linguist Sher Wali Aseer said that Chitral was home to about a dozen languages with Khowar being the third big lingo in the province. Two languages, Wakhi and Yadgha, didn’t have their own scripts and depended on oral tradition, he added.
Prof Mohammad Ali Dinakhel said that the author tried his best to present a linguistic map of Chitral valley with graphic details in past, present and future perspective on scientific lines.
“All the 12 languages spoken in Chitral are reflective of rich cultural diversity and should be promoted and preserved according to the practical measures given in the said book. Being polyglots, residents of Chitral are peace-loving, accommodative and open-minded,” he said.
Prof Abaseen Yousafzai, who chaired the event, stated that linguistic diversity served as window to culturally rich society and social cohesion at large. The book, he said, had description of beautiful poetic pieces by noted poets of Chitral and carried other valuable information regarding numerical trend, social and cultural traditions of locals.
Published in Dawn, March 4th, 2024
",https://www.dawn.com/news/1818993/writers-call-for-preservation-of-linguistic-diversity,peshawar,2024-03-04
14,Karak receives snowfall after two decades,Local journalist says areas had also received snowfall in 1990 and 2004.,"

A man enjoys snowfall in Jandri, Karak, on Sunday. — Dawn

 
KARAK/SWABI: Several parts of Karak district received heavy snowfall on Sunday afternoon after around two decades.
An official said that snowfall blanketed the rural localities in Jandri union council. He said that the areas received six to 10 inches snow. The snowfall continued for at least one hour from 3pm to 4pm.
Motorists and passengers stopped on Peshawar-Karachi Highway to enjoy the snowfall. Local journalist Shafiuddin said that several localities along the highway including Jandri, Speena, Palosasar and Sabirabad received the snowfall after a long time.
He said that the areas had also received snowfall in 1990 and 2004. He said that people came out of their houses to enjoy the snowfall.
The district administration sent a team of officials to the areas to supervise flow of traffic on the busy highway and make arrangements to avert any untoward incident.
In Swabi, Beer Gali region of Gadoon Amazai received snowfall for the first time on Saturday night and Sunday, prompting people to visit the scenic region.
Beer Gali is situated 64-kilometre away from district headquarters in the northeast. Locals said that they wanted to visit Beer Gali to enjoy the natural beauty and scenic environment of the region, surrounded by green mountains.
Beer Gali shares boundaries with Haripur and Buner districts. It is for the first time in the history of the district that the area has received snowfall.
Dr Mohammad Oqail Farooqi, a resident of the area, when contacted, said that the serious issue was that the required facilities and communication between Beer Gali and rest of the district were not modernised during the two the previous two governments of Pakistan Tehreek-i-Insaf owing to which tourists could visit the scenic region.
Locals said that many influential people had built houses in Beer Gali to enjoy the lush greenery and clean environment of the region. They said that such well-off people stayed in the region only in the harsh summer season.
Published in Dawn, March 4th, 2024
",https://www.dawn.com/news/1818992/karak-receives-snowfall-after-two-decades,peshawar,2024-03-04
