,Header,Summary,Detail,Link,Category,CreationDate,Pic_url
0,Parks get upgrade ahead of Eid,"PHA adds new rides, attractions and food options to all parks in Rawalpindi","On the occasion of Eidul Fitr, Parks and Horticulture Authority (PHA), Cantonment Boards and Municipal Corporation have added modern rides, and activities in all 44 amusement parks of Rawalpindi for the enjoyment of families and children.
Joyland, Allama Iqbal Park, Patriata, Rumi Park, Nawaz Sharif Park, 502 Workshop Park, Ladies Park and Children’s Park have been all been renovated and new flowers have been planted just in time for Eid.
Ayub Park Zoo Jungle Kingdom has added more wild birds, pets and wild animals, including tigers and leopards. For the interest of children, dodging cars, ponies, camels for riding have also been introduced in Ayub Park while magic show counter has also been added. Another one of the added amenities include boat riding, for which boats have been brought to both the lakes of Ayub Park.
Military weapons and war helicopters have also been installed at Ayub Park, along with Mono-train and computerised shooting toys. Ayub Park has also arranged local specialties such as saag, maize roti, butter and lassi which will be served at the local food counter that has been decorated in an appealing village-inspired style.
The chair lift at Patriata has also been upgraded and will be become operational from the first day of Eid.
PHA Director General Ahmed Hasan Ranjha said “This year we have enhanced the beauty of all our parks immensely. All kinds of fruit trees have been planted and new food stalls have been added at the parks.”
Entry to all parks will be free. However, tickets for sightseeing items have been increased and the parking fee for cars and motorcycles in amusement parks has also doubled. Families who come for entertainment this year on Eidul Fitr may face difficulty owing to increased prices.
Published in The Express Tribune, April 9th, 2024.
",https://tribune.com.pk/story/2462102/parks-get-upgrade-ahead-of-eid,islamabad,2024-04-08,https://i.tribune.com.pk/media/images/2003733-patriata_charlift-1561965075/2003733-patriata_charlift-1561965075.jpeg
1,Officials inspect arrangements for Baisakhi festival,Baisakhi festival starting from April 12 in Gurdwara Sri Panja Sahib in Hasan Abdal,"Punjab Additional Home Chief Secretary Noorul Amin Mengal visited Gurdwara Sri Panja Sahib along with Provincial Minister for Minority Affairs Sardar Ramesh Singh Arora to review the arrangements regarding the upcoming Baisakhi Mela.
According to sources, during the visit, security and other arrangements were approved for Baisakhi festival, starting from April 12 in Gurdwara Sri Panja Sahib.
Attock DPO Sardar Ghiyas Gul Khan, DC Rao Atif Raza, Hasan Abdal Assistant Commissioner Dr Sana Ramchand and other senior officers were also present on the occasion.
The additional home secretary was briefed on the arrangements made regarding the Baisakhi festival to begin at the Gurdwara.
Expressing satisfaction over the security arrangements on behalf, he said the all possible facilities should be provided to the pilgrims coming from all over the world, including India. He reiterated that no compromise would be tolerated regarding the security.
Mengal instructed the officials of all the concerned departments to perform their duties honestly. Provincial Minister for Minority Affairs Ramesh Arora said the government of Pakistan provides protection to the minorities along with complete religious freedom, for which the minorities were very grateful.
He said the arrangements made for Baisakhi Mela are commendable. It is hoped that accommodation and other facilities will be effectively provided to the pilgrims during the three-day festival.
The Sikh community also presented him with a traditional Saropa (a robe of honour). After a brief visit, the additional home chief secretary left for Punjab.
Published in The Express Tribune, April 9th, 2024.
",https://tribune.com.pk/story/2462103/officials-inspect-arrangements-for-baisakhi-festival,islamabad,2024-04-08,https://i.tribune.com.pk/media/images/1694272-Baisakhifestival-1524635414/1694272-Baisakhifestival-1524635414.JPG
2,Rescued bear undergoes surgery,Vets complete medical check-ups of eight furry creatures at wildlife rehab centre,"The Four Paws veterinarians, in collaboration with the Islamabad Wildlife Management Board (IWMB) rescue team, conducted veterinary checks on eight Asiatic bears which were rescued from various parts of Punjab.
This included castration of male bears, dental treatment, dressing of wounds, and removal of infected teeth for all three bears.
These bears are currently housed in the rescue and rehabilitation centre at the old zoo site in Islamabad. With this final round of treatment on Sunday, all eight Asiatic bears (six males and two females) have completed their treatment and surgical procedures.
The Four Paws team members, including Dr Frank Goeritz, Dr Amir Khalil, Dr Marina Ivanova, Velizar Angelov, Ahmad Badal, and Pia Einheimler, along with IWMB's Dr Usman, Sakhawat, Sana Raja, and Aneela, have been on-site for three days, providing essential medical, clinical, and surgical care to these animals recently confiscated from various cities in Punjab.
Dr Amir Khalil, leading the Four Paws team, held meetings with IWMB's chairperson Rina Saeed, board members, and local officials, assuring the group's assistance in constructing a sanctuary for bears and providing expertise in this regard.
Several cases of maltreatment of Asiatic bears have been reported in Pakistan, where they are subjected to torture, made to dance, and forced into fights for monetary gain by their captors.
The animals were rescued from different cities in Punjab based on the special instructions and interest of Marriyum Aurangzeb, senior minister of the Punjab. Many of them had wounds, pulled-out nails, and broken teeth.
There are still three or four bears rescued by the Punjab Wildlife Department from Sargodha and Bahawalnagar, ready to be housed and treated in Islamabad once transferred.
Owais Awan, Advocate counsel for IWMB, emphasised the need for a No Objection Certificate (NOC) from the Punjab Wildlife Department for the handover of these animals. He stated that since the Four Paws team is in Islamabad, the sooner they are shifted for treatment and checkup, the better.
The Four Paws spokesperson mentioned that the global animal welfare group performed various medical procedures, including ultrasound, vaccinations, anti-parasite treatments, micro-chipping, claw trimming, and teeth treatment. One female bear named Barfi underwent a life-saving dental procedure, and a male bear named Bhaloo had a wound on his neck treated and three teeth surgically removed due to inflammation and abscess. Another male bear, Cuckoo, received dental treatment for five teeth due to issues from illegal captivity as a dancing bear.
Published in The Express Tribune, April 9th, 2024.
",https://tribune.com.pk/story/2462104/rescued-bear-undergoes-surgery,islamabad,2024-04-08,https://i.tribune.com.pk/media/images/Bear-India-Pakistan-border-1-reuters1623763830-4/Bear-India-Pakistan-border-1-reuters1623763830-4.jpg
3,Zakat beneficiaries left in lurch ahead of Eid,Four DZCs in Pindi division have yet to receive funds from the Punjab government,"Around 19,000 poor families may not be able to receive the Eidul Fitr gift package from the four District Zakat Committees (DZCs) in the Rawalpindi division owing to the paucity of public funds as the Punjab government and the relevant authority have yet to release funds.
Officials claim that a severe economic and financial crisis is preventing the government from releasing funds for the destitute. Officials of DACs have started advising beneficiaries to wait till Eid.
Since 1980, Eid gifts ranging from Rs10,000 to Rs12,000 are distributed among eligible Zakat recipients in Punjab in the last 10 days of Ramazan every year. This amount includes the quarterly instalment of Rs9,000 and an Eid gift of Rs3,000.
Each year, from the 20th to the 25th of Ramazan, financial assistance in the form of Eid gifts is distributed among all eligible poor families, orphans, widows, and divorced women through Easy Paisa. These families rely on state funds to celebrate the colours of Eid.
The DZCs sent letters to both the Punjab government and the competent authority on the 1st of Ramazan, requesting financial assistance, however, they have not received any response yet. Furthermore, no meetings have been scheduled for the local Zakat Committees and DZCs regarding the provision of Eid gift financial assistance.
Sources in the District Zakat Council (DZC) Rawalpindi confirmed that there is no information available regarding the Eid package for Zakat beneficiaries. There is complete silence as even the letters and reminders sent for funds have not received any response yet, they added. The sources further added that if the funds are received today, the majority of the beneficiaries will receive gifts after Eid.
Hundreds of widows, orphans, and deserving families are forced to leave the Zakat Council office without cash every day. They are seen lamenting the government for ignoring their miseries and depriving them of Eid celebrations.
The widow and mother of five, Ayesha Begum says the delight of Eid has always been amplified by the tradition of receiving Eid gifts each year, however, this year her hope has been shattered.
Ayesha and several other women have been frequently visiting the Zakat Council office since the beginning of Ramazan, but return empty-handed with a glimmer of hope. They have urged the Punjab chief minister to promptly disburse the financial assistance from the Zakat Fund.
Office-bearers yet to be appointed
Separately, the chairmen and members of the District Zakat Committees in 43 districts across Punjab have not been appointed yet. The Rawalpindi district alone has 1,166 local zakat committees, while each district in the province has between 750 to 1,400 local zakat committees at the union council level. However, the chairmen and members of these local zakat committees have not been appointed.
The organisational structure at the division, district, tehsil and local union council levels is currently in limbo. At the district level, Deputy Commissioner Administrators and Local Zakat Committees are run by the government officers of grade 16 as Administrators.
Published in The Express Tribune, April 9th, 2024.
",https://tribune.com.pk/story/2462106/zakat-beneficiaries-left-in-lurch-ahead-of-eid,islamabad,2024-04-08,https://i.tribune.com.pk/media/images/623022-charity-1382852017/623022-charity-1382852017.jpg
4,Inmates to meet loved ones on Eid,"Families, including children will visit Adiala Jail with gifts, Eidi to meet prisoners","Special ""Eid meetings"" will be held between more than 7,000 prisoners and their families in Central Jail Adiala on April 9 (today).
For the convenience of the families, the meeting time in Adiala Jail has been set between the hours of 8am to 5pm. All the citizens or families who will come today to meet their loved ones who are imprisoned, they will be allowed some time to spend with the prisoners on account of Eid festival.
On this occasion, families will gift new Eid clothes, shoes, fruits, sweets and essentials to their imprisoned family members. A large number of women and children will come for the meetings.
Adiala Jail Superintendent has ordered the computerised counter to open at 8am for meetings with all the prisoners. The registration process for the meetings will begin at 8am and will continue until 3pm, while the first round of meetings will begin at 9am. There will be no registrations for meetings after 3 pm.
The allowed duration of each meeting will be 40 to 45 minutes. At one time, 150 men and the same number of women and children will be able to meet their loved ones in prison. Meetings will be held for all families that arrive by 5pm.
Special counters have also been set up inside the jail to supply Eid gifts brought by families to the prisoners. Immediately after the meeting, these items will be delivered to the concerned prisoners.
The meetings will be continued under the supervision of Assistant Superintendent. A separate arrangement has been made for parking the vehicles of the citizens coming for the meeting.
Published in The Express Tribune, April 9th, 2024.
",https://tribune.com.pk/story/2462101/inmates-to-meet-loved-ones-on-eid,islamabad,2024-04-08,https://i.tribune.com.pk/media/images/1335989-AdialajailEXPRESS-1487783135/1335989-AdialajailEXPRESS-1487783135.jpg
5,"Swiss tourist, aides robbed at gunpoint","Robbery sparks territorial dispute between capital, Taxila police","A foreign female tourist and five of her Pakistani companions fell prey to an armed robbery while exploring the cultural richness of the federal capital while hiking on a path to Taxila.
The distressing incident unfolded as a group comprising the foreign national was on the way to Taxila when the armed robbers intercepted them.
The aftermath of the robbery sparked a territorial dispute between the Taxila and Golra police, prompting swift action from the Islamabad Operations DIG.
According to police sources, the foreign tourist and her Pakistani friends parked their vehicles in Shah Allah Ditta before setting off on a hike towards a Stupa in Taxila. Armed robbers, whose identities remain unknown, ambushed the group, held them at gunpoint, and confiscated their mobile phones at Mouza Parache Khurman. Subsequently, they forced the victims to withdraw Rs120,000 from an ATM before releasing them.
The tourists were reportedly kept in wrongful confinement near the Stupa, falling within the Taxila police station's jurisdiction. However, their vehicles were parked near Golra police station at Shah Allah Ditta. The foreign lady is believed to be from Switzerland, as per available information.
A Golra police station officer highlighted that the hiking trail near Shah Allah Ditta village is popular among tourists exploring Taxila's Buddhist culture. Tourists typically return in the evening after visiting the Buddha statues and cultural sites. Unfortunately, the area known as ""Parache Khurman"" along this route is notorious for frequent thefts targeting tourists. Although this area falls under Taxila police station's jurisdiction in Rawalpindi, Golra police often handle such incidents due to the lack of attention from Rawalpindi authorities.
Regarding the absence of a police patrolling system along this vulnerable route shared by federal and Taxila police jurisdictions, aimed at protecting tourists from criminals, including those believed to hide in Mauza Parache Khurman, the officer confirmed the lack of such security measures. However, Golra police assured that they would register a case and apprehend the culprits responsible for the robbery.
This incident underscores the urgent need for enhanced security measures and collaborative efforts between police stations to ensure the safety of tourists exploring historical and cultural sites in the region.
Published in The Express Tribune, April 9th, 2024.
",https://tribune.com.pk/story/2462100/swiss-tourist-aides-robbed-at-gunpoint,islamabad,2024-04-08,https://i.tribune.com.pk/media/images/gun-file1710526523-0/gun-file1710526523-0.jpg
6,Officials clash over ‘unwarranted interference’,"Video showcasing heated confrontation between cops, excise officials goes viral","Tensions escalated between officials of the Excise, Taxation, and Narcotics Department and the police over allegations of harassment directed at liquor permit holders leaving a five-star hotel on Mall Road in Rawalpindi.
The incident, which unfolded in public and was captured on video, quickly went viral on social media, showcasing a heated confrontation between the two agencies.
The video depicts police personnel halting vehicles outside the hotel and reportedly harassing liquor permit holders. This public display of discord prompted swift action from SSP Operations Hafiz Kamran Asghar, who suspended two officials involved in the incident and initiated internal investigations.
According to sources, permit holders voiced their grievances against alleged harassment by police officers who intercepted vehicles leaving the hotel after patrons purchased liquor with valid permits. The checkpoint, established opposite the private hotel on Mall Road, became a focal point of contention as permit holders accused the police of unwarranted interference.
During one such operation, Civil Lines police station personnel stopped a vehicle outside the hotel. When confronted by a woman excise inspector and her team, the police maintained their position on conducting checks, leading to a verbal confrontation captured in the video.
Witnesses at the scene claimed that police officers were unnecessarily recording details from the permits and causing inconvenience to permit holders.
In the video, the excise inspector questioned the authority of the police to independently conduct checks without joint oversight, as previously agreed between the two departments for addressing any suspected illegal activities. The exchange highlighted discrepancies in procedures and responsibilities between the police and Excise departments.
Further complicating the situation, allegations surfaced regarding the filing of a wrongful FIR against an elderly individual unrelated to the hotel incident. This accusation, along with ongoing tensions, underscored the strained relationship between the two agencies.
ETO Excise Gul Sher clarified that non-Muslim permit holders, especially during the Easter festival, are permitted to possess and transport alcohol with valid permits. However, instances of alleged harassment and misconduct by certain police officers led to formal complaints and internal investigations within the Excise department.
In response to the video and escalating tensions, SSP Operations Hafiz Kamran Asghar emphasised the primary duty of police personnel in crime prevention and security enforcement. Any deviations from these responsibilities, as evidenced in the video, would result in stringent departmental actions against the involved officials.
Published in The Express Tribune, April 9th, 2024.
",https://tribune.com.pk/story/2462105/officials-clash-over-unwarranted-interference,islamabad,2024-04-08,https://i.tribune.com.pk/media/images/punjab-police1710701593-0/punjab-police1710701593-0.jpg
7,Courts grant bail pleas ahead of Eid,Over 300 offenders confined in Adiala jail over petty crimes have been released,"As Eidul Fitr approaches, the District Sessions Civil Magistrate Special Courts and Lahore High Court’s Rawalpindi Bench have granted bails to 316 accused in various cases in Adiala Jail based on Eid mercy and have ordered their release.
These bail applications had been filed between the 1st of Ramazan and Tuesday. The hearing of bail applications of 285 accused is presently ongoing. All courts are hearing 10 to 30 bail applications per day. As many as 300 more accused are likely to be granted bail by the High Court and subordinate courts till Eid. Those whose applications have been approved have been started to be released from jail.
According to judicial traditions, all the courts accept bail applications in minor cases every Ramazan, as a show of special mercy on Eid. The accused who do not get bail on normal days, wait for Ramazan to file their bail applications.
Trial courts have also suspended the cases of punishing the accused in the last 10 days of Ramazan. The purpose of this is to allow the accused to mingle with other prisoners in the jail and celebrate Eid. After the Eidul Fitr holidays, the judgments of the cases will be started.
The Senior Most Judge of Rawalpindi Bench, Justice Sadaqat Ali Khan, has also issued instructions to all subordinate judiciary of Rawalpindi Division to hear all bail applications filed before Eid daily and decide upon them.
Even two days before the Eid holidays, the staff of the Session Judges of the four districts of Rawalpindi, Attock, Jhelum and Chakwal will be present in the offices from 9 am to 7 pm to hear the bail applications.
Instructions have also been issued to ensure the release of any accused who is granted bail by any court one day before Eidul Fitr. Only five working days are left before Eid. Those accused who will apply for bail within the next three days are expected to have their applications decided upon.
Both division benches and all single benches of the Rawalpindi High Court have also started daily decisions on all bail applications filed.
Moreover, in compliance with the strict instructions of the High Court, judges of the session and district courts of Rawalpindi and Islamabad will visit Adiala Jail on Friday and Saturday, the 5th and 6th of April, where these judges will issue orders for the release of all accused persons arrested for minor crimes on personal bail so that they can celebrate Eid joyfully.
The Adiala Jail superintendent has been ordered to make all necessary arrangements in this regard and to prepare a list of accused persons arrested for minor crimes before the visit of these judges.
Published in The Express Tribune, April 9th, 2024.
",https://tribune.com.pk/story/2462107/courts-grant-bail-pleas-ahead-of-eid,islamabad,2024-04-08,https://i.tribune.com.pk/media/images/594498-prisonersreuters-1377314234/594498-prisonersreuters-1377314234.jpg
8,LEAs chalk out security plan for Eidul Fitr,"Over 3,000 personnel to ensure law and order in Rawalpindi","The Rawalpindi police, in collaboration with other law enforcement agencies, have designed a comprehensive security plan to ensure law and order during the upcoming Eidul Fitr festivities.
The implementation of this plan is set to commence from Chand Raat, covering various tourist spots, entertainment venues, Eid prayer congregations, and the ensuing holidays.
Robust deployment of over 3,000 police personnel is planned across the city, with a focus on safeguarding Eid prayer gatherings held in open areas and imambargahs. Furthermore, special arrangements have been made for female worshippers, with the appointment of dedicated female police personnel.
According to police sources, the security strategy encompasses a foolproof approach, involving more than 3,300 personnel to safeguard jamia masjids, imambargahs, and Eid Gahs. Particularly during Chand Raat and Eid, 400 officers from Rawalpindi police will be stationed strategically along Murree Road, Jhelum Road, Bank Road, Peshawar Road, Rawal Road, Syedpur Road, and Airport Road.
They will curb dangerous activities such as one-wheeling, car skating, and other hazardous stunts on the main thoroughfares, ensuring the safety of celebrants.
In addition to the police force, elite units, mounted police, dolphin forces, security guards, and female police will be actively involved in security operations throughout Eidul Fitr. Enhanced patrolling measures have been put in place, utilising police station mobiles and motorcycle-mounted units to cover their respective areas effectively.
Similarly, more than 500 traffic police officers will perform traffic duty to maintain the flow of traffic throughout the city. Over 250 police officials will perform duties in public places and parks, while 300 have been deployed at the main graveyards of the city.
According to the CPO, the Rawalpindi police have ensured fool-proof security on the occasion of Eid by using all possible resources. The safety of life and property of citizens is the priority for which all resources are being used, he said.
Eid prayers will be conducted at various venues including Eid Gah Sharif, Liaquat Bagh, Eid Gah Gwalmandi, Government Gordon College, Liaquat Bagh Sports Complex, Medical University, Shahbaz Sharif Park, Satellite Town, Government Degree College for Boys, and Sixth Road. Worshippers attending these congregations will undergo thorough security checks, with walk-through gates installed at specified entry points to address any security concerns.
A police spokesperson said that Rawalpindi police is fully committed to ensuring the safety and security of citizens during the Eid celebrations. The public is encouraged to promptly report any suspicious activities or incidents to the authorities. Rawalpindi The police’s focus during Eid prayer gatherings will not only be on security but also on maintaining a vigilant stance against criminal activities.
Published in The Express Tribune, April 9th, 2024.
",https://tribune.com.pk/story/2462099/leas-chalk-out-security-plan-for-eidul-fitr,islamabad,2024-04-08,https://i.tribune.com.pk/media/images/eidsecuritypolicefile1651422388-0/eidsecuritypolicefile1651422388-0.jpg
