,Header,Summary,Detail,Link,Category,CreationDate
9,Jhuddo town faces acute shortage of water,"MIRPURKHAS: About 300,000 population in Jhuddo town have been deprived of tap water for past couple of weeks, ...","MIRPURKHAS: About 300,000 population in Jhuddo town have been deprived of tap water for past couple of weeks, forcing people to buy costly water cans and bottles to meet their daily needs. 
The town’s social workers and growers, Khalid Arain, Shahjahan Shah, Jameel Arain, Ghulam Rasool Mugheri and others complained to local media persons that the minors supplying water to their town were running dry due to ongoing rotation programme for Nara Canal, hence no water for reservoirs of the town’s water supply network.
They said the town had been grappling with acute shortage of water for past few weeks and attributed the problem to unabated theft of water being committed by big landlords in connivance with corrupt irrigation officials, who were supplying the already scarce commodity to farmlands at the expense of humans.
They claimed that armed henchmen of big landlords in connivance with corrupt irrigation officials had stopped water supply to tail-end of Buggi minor near Dajero Mori with the help of a tractor. No one dared intervene and even officers concerned were avoiding action against the culprits, they said. 
They demanded Sindh chief minister, secretary of irrigation, director of Nara Canal and others ensure supply of water was resumed to the minor without further delay and legal action was taken against the landlords and their henchmen involved in this serious crime.
Published in Dawn, April 17th, 2024
",https://www.dawn.com/news/1827895/jhuddo-town-faces-acute-shortage-of-water,karachi,2024-04-17
10,"Man, woman gunned down for ‘honour’",LARKANA: Two armed men gunned down a youth and a young woman in the name of honour in Mir Ali Hassan Brohi village ...,"LARKANA: Two armed men gunned down a youth and a young woman in the name of honour in Mir Ali Hassan Brohi village in Qubo Saeed Khan taluka on Tuesday.
Amanullah Sandelo alleged in an FIR lodged with Qubo Saeed Khan police station that Aaurangzeb Brohi and Haji Mir Gul Brohi had killed his son Sanaullah Sandelo, 26, and their relative Huma Brohi, 20, after having branded them as karo-kari. 
Police conducted raids on the suspects’ houses but did not find them as they had already vacated their residences and left for unknown destination, said police officials. 
Police shifted the dead bodies to Qubo Saeed Khan taluka hospital and said the double murder was committed in the name of honour. 
Larkana DIG Nasir Aftab took notice of the incident and asked Qambar-Shahdadkot SSP to arrest the killer. However, no arrest had been made so far.
Published in Dawn, April 17th, 2024
",https://www.dawn.com/news/1827894/man-woman-gunned-down-for-honour,karachi,2024-04-17
11,SHRC wants more funding for Sir Cowasjee mental health facility,"HYDERABAD: The Sindh Human Rights Commission (SHRC), following its inspection team’s March 20 visit to the Sir...","HYDERABAD: The Sindh Human Rights Commission (SHRC), following its inspection team’s March 20 visit to the Sir Cowasjee Jehangir Institute of Psychiatry, has urged the provincial health secretary to pay due consideration to its recommendations, primarily increased budgetary allocations, to help the institute overcome its “critical deficiencies”.
SHRC Chairman Iqbal Detho, in a communication to the secretary on Tuesday, said that the inspection team headed by him had visited the institute with the overarching objective of scrutinising conditions and standards of mental health services at this facility.
The inspection team felt that there was a pressing need for concerted efforts to address the challenges being faced by this healthcare facility. The critical deficiencies included shortage of staff, infrastructure, patient services and budgetary allocations which required immediate attention.
The commission urged the health secretary to prioritise resource allocation and expedite recruitment process to address the issues.
The SHRC has attached its inspection report with the communication and suggested that health department should pay due consideration to six key areas mentioned under subtitles like staff shortage and infrastructure deficiencies; implementation of holistic patient care initiatives; vocational and non-formal education; establishment of old-age home facility; strengthening of support services for vulnerable patients and legislative advocacy; and compliance for drafting rules of implementation of the Sindh Mental Health Care Act-2019. Some of these measures are supposed to be taken by health department in consultation with culture and law departments, Sindh technical education authorities and Nadra.
‘A unique institution’
According to the inspection report, the Sir Cowasjee Jehangir Institute of Psychiatry is a unique institution dedicated to provision of mental healthcare services. With a multidisciplinary team of mental health professionals comprising psychiatrists, psychologists, social workers and psychiatry nurses, the institute strives to deliver evidence-based interventions tailored to cater to the needs of each patient.
Despite being such a unique institution, the mental healthcare facility faces myriad challenges in fulfilling its mandate effectively. From staff shortage to infrastructural limitations, it grapples with countless obstacles that impede its ability to provide optimal care and support to individuals in need for rehabilitative nature. As an integral component of mental healthcare landscape in Sindh, the institute plays an indispensable role in safeguarding health and well-being of community.
Elaborating the six specified areas, the commission suggested that vacant positions must be filled by prioritising recruitment of psychiatrists urgently and to chalk out clear strategies to attract and retain qualified professionals, besides recruiting lower-grade workers. It suggested partnerships with academic institutions, teaching hospitals and professional bodies.
It stressed allocation of adequate funds for the procurement of ambulances and essential medical equipment. It also called for a maintenance plan for the existing infrastructure. 
The commission advised culture department to introduce a patient care programme featuring indoor recreational activities and music therapy to support patients’ rehabilitation and well-being. 
For vocational and non-formal education of patients, the SHRC suggested, a partnership could be established between the hospital and the Sindh Technical Education and Vocational Training Authority (Stevta).
The commission is of the view that a separate building should be established for the under treatment elderly and senior citizens. 
It has proposed effective implementation of the Sindh Mental Health Act-2019 and its rules for the rights and welfare of individuals with mental health disorders. It said that relevant authorities and stakeholders should be engaged to expedite adoption and implementation of legislative reforms aimed at improving mental healthcare services.
Published in Dawn, April 17th, 2024
",https://www.dawn.com/news/1827893/shrc-wants-more-funding-for-sir-cowasjee-mental-health-facility,karachi,2024-04-17
12,Traders shutter shops to protest rising crime in Ratodero,LARKANA: Shopkeepers in bustling Resham Gali bazaar in Ratodero town shuttered their shops on Tuesday in protest...,"LARKANA: Shopkeepers in bustling Resham Gali bazaar in Ratodero town shuttered their shops on Tuesday in protest against deteriorating law and order conditions in the town and demanded the administration provide them atmosphere conducive for trade.
The protesters’ leaders Saindad Joyo, Anees Junejo, Liaquat Brohi and others told reporters that incidents of exchange of fire between rival groups in the middle of the bazaar had become almost a routine where police remained silent spectator. 
Many warring tribes, they said, had chosen this area to settle their old scores and freely engaged in exchange of fire in the market, which naturally affected their businesses.
They said that a pedestrian woman died after a stray bullet hit her when Vessar and Brohi tribesmen traded fire in the market a few days back. In another incident in Eid night, trade of fire between Jalbani and Vessar clans left two persons injured, they said, adding on Monday again, Vessars and Jalbanis exchanged fire in Resham Gali. 
The protesters demanded elected representatives Bilawal Bhutto-Zardari, Faryal Talpur, Larkana DIG and SSP set up permanent police pickets in the market to check the miscreants so that traders could carry on their business with peace of mind. 
They urged the government and influential persons of the area to end ongoing disputes between different tribes and clans.
Published in Dawn, April 17th, 2024
",https://www.dawn.com/news/1827892/traders-shutter-shops-to-protest-rising-crime-in-ratodero,karachi,2024-04-17
13,SHO asks court to revoke assault suspect’s bail,BHYDERABAD: SHO of Railway police station moved the court of civil judge and judicial magistrate-II on Tuesday and...,"BHYDERABAD: SHO of Railway police station moved the court of civil judge and judicial magistrate-II on Tuesday and sought cancellation of bail granted to a railway policeman, who was main suspect in the mysterious death of a female passenger on Millat Express. 
The suspect Mir Hassan had obtained bail in a sum of Rs35,000 after he was arrested for assaulting Ms Maryam Bibi of Jaranwala onboard Faisalabad-bound Millat Express on April 7. He was arrested by police and a case was lodged against him for assaulting the woman after his footage went viral during Eid days. 
The SHO, Sub-Inspector Mohammad Hussain, informed the court that the suspect was not cooperating with police in the investigation of the case. Police had produced him in the court on April 13 to seek his remand in police custody but Consumer Protection Court judge declined the police’s request and accepted the suspect’s bail for Rs35,000, he said.
He said that since the suspect was not cooperating, police also needed to have his medical examination done by an authorised medical officer so as to assess his state of mental health. Therefore, he contended, the court should allow the suspect’s remand in police custody and recall his bail order. 
The court issued notice to the suspect on the SHO’s application and asked him to appear before the judge on April 22.
Published in Dawn, April 17th, 2024
",https://www.dawn.com/news/1827891/sho-asks-court-to-revoke-assault-suspects-bail,karachi,2024-04-17
