,Header,Summary,Detail,Link,Category,CreationDate,Pic_url
7,Baqir urges new govt to tackle 'economic hurdles',Stresses need to address sustainability of Pakistan’s debt,"As Pakistan eagerly awaits the outcome of its 2024 elections, the nation finds itself at a critical juncture, grappling with economic challenges that have long plagued its stability. Former central bank governor, Reza Baqir, highlighted the pressing need for sustainable economic policies in a recent interview with Bloomberg TV, underscoring Pakistan’s daunting debt burden and the imperative of restoring investor confidence.
With ballots being tallied, citizens from all walks of life are looking to the incoming government with renewed hope, yearning for policies that will alleviate inflation and stimulate economic growth. 
“Pakistan’s new government will need to start negotiations early for a new loan package with the International Monetary Fund (IMF) as the country has ‘significant’ payments due to the global lender,” said the former central bank governor. Baqir underscored the significance of Pakistan’s relationship with the IMF and the urgent need to curb inflation, which has soared to unprecedented levels of 30-40%.
“In my view, the number one priority has to be how to protect the poor from the very high inflation that Pakistan has seen over the last couple of years. Headline inflation of around 30%, food inflation of 40%. These are unprecedented levels in decades,” he said, adding that, “I think the number one challenge is going to be how to put the economy on a sustainable footing and how to manage its relationship with the IMF,” said the former SBP governor. 
Read Stocks surge on debt settlement talk
Speaking about what conditions Pakistan will have to fulfill in order to secure the next IMF programme, Baqir highlighted the need for ownership of the reform program. “The first goal is going to be how does Pakistan make a more equitable tax system? How does Pakistan bring into the tax net people and privileged classes, who have avoided taxes instead of continuing to squeeze those in the middle class and the salary-earning people? How Pakistan can broaden its base? These are fundamental questions of ownership, and if the new government generates the ownership around the reform momentum and is less seen as dictated from above by the IMF, the chances of it being sustainable are going to be much higher,” he said.
Published in The Express Tribune, February 9th, 2024.
Like Business on Facebook, follow @TribuneBiz on Twitter to stay informed and join in the conversation.
 
",https://tribune.com.pk/story/2455853/baqir-urges-new-govt-to-tackle-economic-hurdles,business,2024-02-09,https://i.tribune.com.pk/media/images/Reza-Baqir1610356786-01611317848-0/Reza-Baqir1610356786-01611317848-0.jpg
8,Balochistan installs modern solar facilities,"Province has solar energy potential of 2,900 gigawatts","Balochistan Caretaker Chief Minister Mir Ali Mardan Khan Domki has inaugurated an extensive solarisation project to shift various public department buildings including educational institutions, healthcare facilities and civic departments onto renewable energy that will provide clean, affordable and uninterrupted power supply to public facilities in the province.
The Balochistan government, with the support of Chinese government, has completed the solarisation of 12 educational institutions, computer labs and hospitals that have been equipped with modern solar power facilities.
Chinese Ambassador to Pakistan Jiang Zaidong participated in the inaugural ceremony where he expressed his views through a video link at the Chief Minister’s Secretariat.
Pakistan’s total installed solar energy capacity was 1.24 gigawatts (GW) by 2022, representing a 17% increase over 2021. The government has proposed many initiatives to increase the share of solar energy.
By now, the country’s solar energy market is estimated to rise at a compound annual growth rate (CAGR) of 49.68% from 1.30 giga tonnes in 2023 to 9.77 giga tonnes in 2028.
In the specific case of Balochistan, according to the Central Asia Regional Economic Cooperation programme, Pakistan’s total technical solar and wind potential stands at 2,900 GW and 340 GW, respectively.
Read Kakar advocates solar innovation
Additionally, Balochistan has the potential to implement greater than 14 GW of renewable energy projects within five to 10 years through least-cost pathways, including photovoltaic (PV) utility-scale plants of 9,500 to 11,500 megawatts.
Balochistan’s geography, irradiance and location make it one of Pakistan’s most high-potential provinces, with respect to renewables. Decentralised micro-grids paired with solar generation could be used to increase reliable electricity access to rural residents.
While micro-grids generally only provide basic electrification (high quality lighting and charging of mobile phones), it is able to do so for multiple households at a significantly lower cost in the long run. An estimated 36% of Balochistan is electrified, so this pairing has immense potential for the province. In the future, the province is poised to become the country’s most booming solar power hub.
This article originally appeared on The China Economic Net
Published in The Express Tribune, February 9th, 2024.
Like Business on Facebook, follow @TribuneBiz on Twitter to stay informed and join in the conversation.
 
",https://tribune.com.pk/story/2455852/balochistan-installs-modern-solar-facilities,business,2024-02-09,https://i.tribune.com.pk/media/images/11681325203-0/11681325203-0.jpg
9,Bonds rise on economic optimism,Become world’s best-performing driven by high hopes ahead of new govt,"Pakistan’s US dollar-denominated Eurobonds and Sukuks have emerged as some of the world’s best-performing bonds in global markets, driven by optimism surrounding the nation’s domestic macroeconomics amidst the ongoing elections to elect new political governments at the centre and in the provinces on Thursday.
The robust rally in these bonds indicates a restoration of foreign investors’ confidence in Pakistan and its future government, which is widely anticipated to unveil a new economic roadmap aimed at addressing the nation’s current economic and financing crises, particularly enhancing its capacity to make foreign debt repayments on time.
Arif Habib Limited (AHL) reported that the price of Pakistan’s 10-year Eurobond, valued at $1 billion and maturing in three months on April 15, 2024, surged to a record high of 98.11 cents on February 7, 2024. The bond, which had traded below 50 cents in June 2023, almost halving its face value of $1, has now rebounded significantly, reaching an exit price of 98.11 cents, it was learnt.
Currently, global traders have invested approximately $7.80 billion in Pakistan’s foreign Eurobonds and Sukuks, with maturity dates ranging from April 2024 to April 2051.
The price of Pakistan’s upcoming 10-year Eurobond, valued at $500 million and maturing on September 30, 2025, rose to 87.81 cents from around 40 cents in June.
Speaking to The Express Tribune, Tahir Abbas, Head of Research at AHL, commented, “The Eurobond price has doubled in the past seven months, emerging as one of the best-performing bonds in global markets.”
The surge in Eurobonds, especially those maturing in April, is attributed to three key factors: the ongoing general elections, anticipation of the new government securing a new International Monetary Fund (IMF) loan programme after the current $3 billion programme concludes in March 2024, and expectations of the central bank cutting its benchmark policy rate by around 7 percentage points to 15% by the end of December 2024, he said.
These developments are expected to create a conducive environment for economic growth, industrial revival, and the creation of new job opportunities.
Read Pakistan’s Eurobonds jump to multi-year highs
Abbas noted that bond prices have continued to rise over the past seven months (July to date), with the rebound beginning after the previous government secured the $3 billion IMF loan programme in late June 2023.
Following the completion of the first economic review of the programme in November 2023, the IMF released the second loan tranche of $700 million in January 2024, affirming Pakistan’s compliance with programme conditions.
Abbas highlighted that Pakistan’s foreign exchange reserves have doubled to over $8 billion compared to less than $4 billion in June 2023, enabling the government to smoothly repay $1 billion to Eurobond global investors on April 15, 2024. Despite facing a foreign exchange reserves crisis, the country successfully repaid $1 billion to foreign investors days before the previous Eurobond matured in December 2022.
In a recent development, global credit rating agency S&P Global Ratings hinted at a potential upgrade to Pakistan’s credit rating to ‘B’ once the new government assumes power, subject to its economic policies and reform efforts. Currently rated ‘CCC+’ by the agency, Pakistan’s credit outlook depends on its ability to secure a new IMF loan programme and ensure timely debt repayments, while fostering economic expansion. The agency will in particular be watching the next government’s moves on approaching the IMF and securing a new loan programme, which will ensure that the country continues to repay foreign debt on time and allows gradual expansion of its economic activities throughout this fiscal year (FY24) and beyond.
Abbas highlighted that global investors will closely monitor the new government’s economic measures, particularly its efforts to attract foreign direct investment (FDI) in export-led sectors, expand the taxpayer base, enhance tax revenue collection, and create fiscal space for economic activities.
Published in The Express Tribune, February 9th, 2024.
Like Business on Facebook, follow @TribuneBiz on Twitter to stay informed and join in the conversation.
 
",https://tribune.com.pk/story/2455850/bonds-rise-on-economic-optimism,business,2024-02-09,https://i.tribune.com.pk/media/images/11707440637-0/11707440637-0.jpg
