,Header,Summary,Detail,Link,Category,CreationDate,Pic_url
0,PSX soars on PM’s election,"KSE-100 index gains 626.04 points, settles at 65,951.73","Pakistan Stock Exchange (PSX) on Monday extended its upward trajectory from the previous week as investors took cue from the election of a new prime minister and upbeat economic data.
In the morning, trading began on a robust note, supported by the shrinking of trade deficit by 30.2% year-on-year (YoY) to $14.87 billion for July-February 2023-24 and the fall in the Consumer Price Index (CPI)-based inflation to 23.1% in February 2024.
Additionally, foreign fund inflows, rupee stability and the declining Karachi Interbank Offered Rate (Kibor) played a key role in maintaining the market’s upward momentum.
Consequently, the KSE-100 index broke the psychological barrier of 66,000 points in the morning, reaching the intra-day high at 66,007.43.
Although the market dipped briefly in the afternoon, touching the intra-day low at 65,532.58, positive sentiment stemming from Shehbaz Sharif’s election as the PM for the second time and the ongoing political developments boosted the index.
The market closed the day near the 66,000 mark with substantial gains, with investor interest being mainly witnessed in the exploration and production (E&P) sector.
“Stocks closed bullish as investors weighed the PM’s election, upbeat data on trade deficit that shrank 30.2% YoY to $14.87 billion for July-February FY24 and CPI inflation that fell to 23.1% for February 2024,” said Arif Habib Corp MD Ahsan Mehanti.
“Foreign inflows, rupee stability and falling Kibor played the role of catalysts in bullish close at the PSX.”
At close, the benchmark KSE-100 index recorded a surge of 626.04 points, or 0.96%, and settled at 65,951.73.
Topline Securities, in its report, said that the KSE-100 index sustained its upward momentum from the previous week. “In a significant political development, Shehbaz Sharif was elected as the prime minister for the second time by the National Assembly, garnering 201 votes,” it said.

Read PSX remains buoyant on political stability
Furthermore, the International Monetary Fund (IMF) proposed the doubling of taxes on both salaried and non-salaried individuals. It also recommended raising the general sales tax rate to 18% for various essential items such as unprocessed food, stationery, medicines and petroleum products, Topline added.
Arif Habib Limited (AHL) reported that 57 stocks rose while 37 fell in the KSE-100 index with E&P names leading the rally. Oil and Gas Development Company (+7.17%), Pakistan Petroleum (+6.01%) and Mari Petroleum (+2.78%) were the biggest contributors to the gains while banks were the main drag.
JS Global analyst Mohammed Waqar Iqbal said that the KSE-100 breached the psychological resistance of 66,000 during the trading session but closed at 65,952, gaining 626 points. “Major interest was seen in the E&P sector,” he said.
“Going forward, we expect the uptrend to continue and recommend investors to view any downside as an opportunity to buy stocks in banking, cement and E&P sectors,” the analyst added.
Overall trading volumes increased to 472.9 million shares against Friday’s tally of 344.2 million. The value of shares traded during the day was Rs16.3 billion.
Shares of 358 companies were traded. Of these, 184 stocks closed higher, 153 dropped and 21 remained unchanged.
Kohinoor Spinning Mills was the volume leader with trading in 67.4 million shares, gaining Rs0.32 to close at Rs5.68. It was followed by WorldCall Telecom with 60.2 million shares, gaining Rs0.08 to close at Rs1.37 and K-Electric with 36.8 million shares, gaining Rs0.15 to close at Rs5.02.
Foreign investors were net buyers of shares worth Rs675.3 million, according to the NCCPL.
Published in The Express Tribune, March 5th, 2024.
Like Business on Facebook, follow @TribuneBiz on Twitter to stay informed and join in the conversation.
 
",https://tribune.com.pk/story/2458381/psx-soars-on-pms-election,business,2024-03-05,https://i.tribune.com.pk/media/images/1271951-psx-1482415848/1271951-psx-1482415848.jpg
1,Two Sessions fosters stronger Pak-China ties,Experts praise conference for promoting global economic stability,"Pakistani experts have lauded the significance of the “Two Sessions” in fostering global economic stability in the context of jointly building the Belt and Road Initiative, particularly China-Pakistan Economic Corridor (CPEC) initiatives.
They believe that the foreign policies and incentives for foreigners in China during these sessions are pivotal in enhancing economic cooperation and promoting sustainable development in the region.
Muhammad Asghar, a correspondent for the Associated Press of Pakistan in China, said that the strategic discussions held during the Two Sessions serve as a platform for fostering stronger ties between Pakistan and China.
“I’m attending different meetings and briefings during the six-day Two Sessions. I will focus on jointly building the Belt and Road Initiative President Xi Jinping launched a decade ago to build a community with a shared future,” he stated.

Read Economic revival, CPEC and Agenda 2047 – IV
“I am also looking forward to attending Foreign Minister Wang Yi media interaction and also the opening and closing ceremonies of Two Sessions in the People’s Great Hall,” he added.
Shahid Afraz Khan, a foreign expert in Beijing, said that the strategic discussions and initiatives undertaken during these sessions serve as a testament to the strong partnership between China and the world and their commitment to sustainable economic development.
“Jointly building the BRI has become the biggest mega development project of the 21st century which is successfully negating the spillover repercussions of geopolitics, protectionism, unilateralism, war-theatre mentality, isolation, marginalisation and gearing the developing countries and Global South towards greater socio-economic integration,” Pakistani expert Dr Mehmoodul Hassan Khan told CEN.

This article originally appeared on The China Economic Net
Published in The Express Tribune, March 5th, 2024.
Like Business on Facebook, follow @TribuneBiz on Twitter to stay informed and join in the conversation.
 
",https://tribune.com.pk/story/2458380/two-sessions-fosters-stronger-pak-china-ties,business,2024-03-05,https://i.tribune.com.pk/media/images/1479947-ChinaPakistanflags-1502533448/1479947-ChinaPakistanflags-1502533448.jpg
2,Police presence bolstered to secure Karachi industries,"Sindh AIGP says initiative aims to curb street crimes, maintain law and order","Sindh Additional Inspector General of Police (AIGP) Karachi Range Khadim Hussain Rind has announced the deployment of an additional 20 police personnel to the SITE Crime Monitoring Cell (SCMC), located within the premises of the SITE Association of Industry (SAI). This initiative aims to curb the increasing incidence of street crimes and maintain law and order in the area.
Rind made this announcement during his visit to the SAI, where he engaged with industrialists to discuss concerns regarding street crimes, snatching, and armed robbery. Industrialists welcomed the reinforcement of 20 police personnel to augment the existing workforce at the base.
Additionally, the AIGP mentioned ongoing anti-narcotics operations targeting suppliers of Gutka, mainpuri, and other illicit substances, resulting in the seizure of chewable items worth billions of rupees. He also highlighted a pending proposal to the Sindh government for the purchase of police vehicles, which, despite six months having passed, is yet to be approved.

Read Murad affirms dogged resolve to control crime
Earlier, SAI President Muhammad Kamran Arbi commended the decision to bolster personnel and informed about the induction of 11 more bikes to enhance policing efficiency. Arbi also recognised the commendable efforts of the police team from SITE-A PS in apprehending the culprits involved in a Rs2.5 million dacoit in the SITE area. He announced appreciation certificates and cash rewards for the team members. Additionally, the AIGP also announced one month’s salary for the police personnel involved in the successful recovery of Rs2.5 million in cash.
SAI, Patron-in-Chief, Zubair Motiwala, raised industry-related concerns and highlighted the importance of proper training for police to proactively prevent crimes. He advocated for an increase in the pay scale of police personnel to enable them to lead respectable and honest lives. Motiwala proposed a meeting between traffic police officials and the SAI to address and resolve traffic-related issues.
Industrialist Jawed Bilwani urged for necessary traffic management arrangements at the entry/exit points of the SITE area during the holy month of Ramazan. He also highlighted the issue of non-functional traffic signals, to which AIGP Rind assured that it would be addressed promptly.
Published in The Express Tribune, March 5th, 2024.
Like Business on Facebook, follow @TribuneBiz on Twitter to stay informed and join in the conversation.
 
",https://tribune.com.pk/story/2458378/police-presence-bolstered-to-secure-karachi-industries,business,2024-03-05,https://i.tribune.com.pk/media/images/1572558-l___print-1512029239/1572558-l___print-1512029239.jpg
3,Apple hit with $2b EU antitrust fine,"Company shares fall by 3% as decision is appealed, Spotify cheers EU ruling","Brussels, on Monday, fined Apple 1.84 billion euros ($2 billion) on Monday, for thwarting competition from music streaming rivals via restrictions on its App Store, the iPhone maker’s first ever penalty for breaching EU rules.
A basic penalty of 40 million euros was inflated by a huge lump sum included as a deterrent – a first for the European Union’s antitrust authorities.
The European Commission charged Apple last year with preventing Swedish streaming service Spotify and others from informing users of payment options outside its App Store, following a 2019 complaint by Spotify.
It said Apple’s restrictions constituted unfair trading conditions, a relatively novel argument in an antitrust case and also used by the Dutch antitrust agency in a decision against Apple in 2021 in a case brought by dating app providers. It ordered it to stop such conduct.
Apple said it would appeal the decision. A ruling at the Luxembourg-based General Court, Europe’s second-highest, is likely to take several years. Until then, Apple will have to pay the fine and comply with the EU order.
Its shares were last down 3%.
The fine was nearly four times the 500 million euros sources with knowledge of the matter had told Reuters they expected the European Commission to impose on Apple.
It comprised a basic element of 40 million euros – described by European Competition Commissioner Margarethe Vestager as a “parking ticket” for the US tech giant – plus 1.8 billion euros slapped on top as a deterrent. The 1.84 billion euros total is equal to 0.5% of Apple’s global turnover, she said.
Apple criticised the decision, saying in a statement it was “reached despite the Commission’s failure to uncover any credible evidence of consumer harm, and ignores the realities of a market that is thriving, competitive, and growing fast.”
“The primary advocate for this decision — and the biggest beneficiary — is Spotify, a company based in Stockholm, Sweden. Spotify has the largest music streaming app in the world, and has met with the European Commission more than 65 times during this investigation,” it said.

Read Apple to disclose AI plans later this year, CEO Tim Cook says
Left in the dark
“Millions of European music streaming users were left in the dark about all available options,” Vestager told a press conference.
“And Apple’s anti-steering rules also made consumers pay more for such services because of the high commission fee imposed on developers and passed on to consumers.”
Spotify cheered the EU decision but said there were other issues in other areas.
“And while we are pleased that this case delivers some justice, it does not solve Apple’s bad behaviour towards developers beyond music streaming in other markets around the world,” the company said in a statement.
Although the fine is big, Apple can handle it without any immediate cash impact, said analyst Ryan Reith at tech and services company IDC.
But he added, “I believe this is another step in the on-going process of breaking down some of the walled gardens that Apple has created around its ecosystem.” In the past decade, the EU regulator has fined Alphabet’s Google a total 8.25 billion euro over three cases.
Vestager’s order to Apple to remove its App Store restrictions echoes the same requirement under new EU tech rules known as the Digital Markets Act (DMA) which Apple has to be in compliance with on March 7.
In contrast to the music streaming case, Apple is seeking to settle another EU antitrust investigation by offering to open up its tap-and-go mobile payment systems to rivals.
EU regulators, who subsequently sought feedback from rivals and users, will likely accept its offer without fining the company.
Published in The Express Tribune, March 5th, 2024.
Like Business on Facebook, follow @TribuneBiz on Twitter to stay informed and join in the conversation.
 
",https://tribune.com.pk/story/2458377/apple-hit-with-2b-eu-antitrust-fine,business,2024-03-05,https://i.tribune.com.pk/media/images/21709586606-1/21709586606-1.jpg
4,Oil steadies after OPEC+ cut extension,Russia’s decision to cut oil output and exports surprises analysts,"Oil prices were little changed on Monday, a day after the widely expected extension of voluntary output cuts through the middle of the year by the OPEC+ producer group.
Brent futures were up19 cents to $83.74 a barrelat 1422 GMT after rising 2.4% last week. US West Texas Intermediate (WTI) rose 6 cents to $80.03 a barrel following a 4.6% gain last week.
The Organisation of the Petroleum Exporting Countries and its allies (OPEC+) are extending their voluntary oil output cuts of 2.2 million barrels per day (bpd) into the second quarter to cushion the market amid global economic concerns and rising output outside the group.

Read Oil gains on potential OPEC+ cuts
As market expectations for a rollover had grown more apparent recently, the extension may have been increasingly priced in, said Walt Chancellor, an energy strategist at Macquarie.
“With OPEC loadings appearing steady and aggregate OPEC supply potentially showing little effect from incremental voluntary cuts implemented in Q1, we do not view the extensions from the broader group as particularly impactful.”
Still, Russia’s announcement to cut its oil output and exports by an additional 471,000 bpd in the second quarter surprised some analysts.
Published in The Express Tribune, March 5th, 2024.
Like Business on Facebook, follow @TribuneBiz on Twitter to stay informed and join in the conversation.
 
",https://tribune.com.pk/story/2458376/oil-steadies-after-opec-cut-extension,business,2024-03-05,https://i.tribune.com.pk/media/images/21691269984-0/21691269984-0.jpg
5,FBR dismisses proposal for 18% sales tax on cars,Believes lower tax on vehicles will result in revenue loss,"The Federal Board of Revenue (FBR) has turned down a proposal of the Ministry of Industries that sought to impose 18% general sales tax (GST) on locally manufactured cars across the board, saying it will result in a fall in tax collection as well as revenue loss.
The Industries and Production Division was requested to provide its input on the rationalisation of criterion for the imposition of 25% sales tax on locally manufactured and assembled vehicles while avoiding the undermining of tax base by ensuring that no car variant and model became liable to a lower tax rate than what was currently applicable.
In response, the Industries and Production Division, in a recent meeting of the Economic Coordination Committee (ECC), proposed that 18% sales tax should be applicable to all local auto manufacturers and assemblers without any discrimination. It, however, recommended that sales tax should not be increased on cars below 1,400cc engine capacity.
However, the FBR did not concur with the recommendation, believing it would allow sports utility vehicles (SUVs) and other vehicles, currently paying 25% sales tax, to pay only 18% tax. It would lead to the shrinking of the tax base as well as revenue loss, it cautioned.
Therefore, “given the commitment under the International Monetary Fund (IMF) standby arrangement, it would not be possible to agree with the proposal,” the FBR said.
It told the meeting that, considering the unprecedented fiscal and current account challenges and the immediate need to pour resources for stabilisation of the economy, the sales tax on luxury goods, previously chargeable at the standard rate (17%), was enhanced to 25% ad valorem in March 2023.
The enhanced sales tax was also applicable to the locally manufactured and assembled double-cabin vehicles.
It was imposed on locally manufactured and assembled vehicles with engine capacity of 1,400cc and above, and locally manufactured/ assembled SUVs/CUVs as a class, irrespective of the engine capacity.

Read PAAPAM decries proposed sales tax hike
The FBR pointed out that the 25% sales tax on SUVs/CUVs, as a class of goods, created market imbalance for vehicles below 1,400cc engine capacity, making them uncompetitive with sedan cars of similar capacity. It stressed that SUVs/CUVs should be provided a level playing field and to address the anomaly, a summary was sent to the Cabinet Committee on Legislative Changes (CCLC) on August 3, 2023, proposing that all locally manufactured vehicles with price exceeding Rs5 million (excluding sales tax), irrespective of the engine capacity or cabin, be made liable to pay 25% sales tax.
Another summary was sent on December 20, 2023, incorporating the views of the Industries and Production Division and proposing 25% GST on all locally manufactured vehicles with invoice price exceeding Rs35 million (excluding sales tax).
It was pointed out that the proposed price benchmark was reduced from Rs5 million as some of the vehicles, currently liable to pay 25% sales tax, had a price less than Rs5 million.
The CCLC considered the matter and its decision was ratified by the federal cabinet. The CCLC did not agree with the FBR’s proposal and directed it to submit the matter to the cabinet after making a thorough internal assessment.
Accordingly, the matter was reconsidered and it was proposed that the condition of 1,400cc engine capacity may be retained to safeguard the tax base.
However, to provide a level playing field to all luxury vehicles, it was proposed that a price benchmark of Rs4 million (excluding sales tax) may be applied as an additional criterion for levying sales tax at the enhanced rate of 25%.
Resultantly, vehicles below 1,400cc and having price less than Rs4 million would attract the standard tax rate of 18%. It was pointed out that all locally manufactured and assembled vehicles below 850cc would remain liable to pay the reduced tax rate of 12.5%.
Similarly, hybrid electric vehicles would enjoy reduced tax rates provided under the Eighth Schedule of the Sales Tax Act 1990. The estimated annual revenue impact of the proposal would be Rs4.5 billion.
Published in The Express Tribune, March 5th, 2024.
Like Business on Facebook, follow @TribuneBiz on Twitter to stay informed and join in the conversation.
 
",https://tribune.com.pk/story/2458375/fbr-dismisses-proposal-for-18-sales-tax-on-cars,business,2024-03-05,https://i.tribune.com.pk/media/images/21690398840-1/21690398840-1.jpg
6,Cement dispatches decline 19.22%,APCMA data shows notable contraction in both local and export markets,"In February 2024, the cement sector witnessed a significant decline of 19.22%, with total dispatches amounting to 3.259 million tonnes (MT), compared to 4.035 MT in the same month of the previous fiscal year. This downturn, as reported by the All Pakistan Cement Manufacturers Association, reflects a notable contraction in both local and export markets.
Local cement dispatches in February 2024 stood at 2.863 MT, marking a substantial decrease of 20.23% from February 2023. Similarly, exports declined by 11.02%, with volumes dropping from 444,962 tonnes in February 2023 to 395,935 tonnes in February 2024.
North-based cement mills dispatched 2.433 MT in February 2024, representing a decline of 19.26% from February 2023, while South-based mills dispatched 826,085 tonnes, reflecting a 19.08% decrease compared to February 2023.
Domestic dispatches from North-based mills totalled 2.338 million tonnes in February 2024, showing a decline of 20.73% from February 2023, while South-based mills dispatched 525,543 tonnes, marking a 17.97% reduction compared to February 2023.
Despite the overall decline, exports from North-based mills increased by 47.40%, reaching 95,393 tonnes in February 2024. However, exports from South-based mills decreased by 20.96% to 300,542 tonnes during the same period.

Read Cement despatches witness decline of 14.79% in Jan
Over the first eight months of the current fiscal year, total cement dispatches reached 30.555 MT, a modest increase of 2.52% from the corresponding period last fiscal year. Domestic dispatches during this period were 26.059 MT, down by 4.22% from the same period last year. However, exports showed a significant increase of 73.10%, reaching 4.496 MT compared to 2.597 MT in the previous fiscal year.
North-based mills dispatched 21.495 MT domestically during the first eight months of the current fiscal year, representing a reduction of 3.73% from July-February 2023. Exports from the North increased by 35.02%, totaling 915,449 tons during July-February 2024. Conversely, domestic dispatches by South-based mills decreased by 6.47%, while exports surged by 86.55% during the same period.
A spokesperson for the All Pakistan Cement Manufacturers Association expressed hope that the new government would introduce industry-friendly policies and address critical issues promptly. The association urges the government to expedite pending public sector development projects to provide relief to the construction industry and the hundreds of thousands of skilled and unskilled labourers associated with the sector.
Published in The Express Tribune, March 5th, 2024.
Like Business on Facebook, follow @TribuneBiz on Twitter to stay informed and join in the conversation.
 
",https://tribune.com.pk/story/2458374/cement-dispatches-decline-1922,business,2024-03-05,https://i.tribune.com.pk/media/images/11602014354-0/11602014354-0.jpg
7,NEPRA gives nod for clean energy proposals,"Under approved RFPs, KE will install solar projects within its territory","The National Electric Power Regulatory Authority (Nepra) has granted approval to two of the three Requests for Proposals (RFPs) submitted by K-Electric (KE) for the addition of renewable energy to its power generation capacity.
“These approvals are a milestone in KE’s strategic plan to integrate renewable energy into its operations, thereby, contributing to a cleaner and more sustainable energy future,” said KE in a statement.
Under the approved RFPs, KE will install solar projects within its territory, aligning closely with the commitment to diversify the generation mix with renewable energy resources.

Read Pakistan, Denmark discuss green energy
KE CEO Moonis Alvi emphasised the importance of these approvals, saying, “As we strive towards the goal to incorporate at least 30% renewables into our fleet by 2030, the approval of these RFPs by Nepra serves as a cornerstone of our ambitious plan. The impending commencement of the installation process signifies a tangible step forward in the journey towards a greener energy ecosystem.”
“With the necessary regulatory approvals, KE is poised to initiate the implementation phase promptly,” he said, adding that the initiative underscored the commitment to sustainability and environmental stewardship, while also contributing to the broader national agenda of transitioning towards clean energy resources.
Published in The Express Tribune, March 5th, 2024.
Like Business on Facebook, follow @TribuneBiz on Twitter to stay informed and join in the conversation.
 
",https://tribune.com.pk/story/2458379/nepra-gives-nod-for-clean-energy-proposals,business,2024-03-05,https://i.tribune.com.pk/media/images/1202534-RenewableenergyISBstorycopy-1476813301/1202534-RenewableenergyISBstorycopy-1476813301.jpg
