,Header,Summary,Detail,Link,Category,CreationDate
8,Bajaur PPP leaders to contest polls as independent candidates,BAJAUR: Two local leaders of Pakistan Peoples Party (PPP) here on Sunday announced to contest elections as...,"BAJAUR: Two local leaders of Pakistan Peoples Party (PPP) here on Sunday announced to contest elections as independent candidates as they were not awarded tickets by their party.
Addressing a news conference, PPP former district president Aurangzeb Khan and district general secretary Mohammad Anees Khan said that they decided to contest elections for PK-22 and PK-21, respectively, as independent candidates.
They claimed that their names were included in the list of candidates for provincial assembly seats that was approved by provincial parliamentary committee of the party. However, they alleged that their names were excluded at the eleventh hour from the list on the request of former MNA Akhunzada Chattan.
The PPP leaders said that it disappointed them. They said that they had launched election campaign several weeks ago with the hope to get party tickets. They said that they were not only senior and active leaders but also played important role in promoting the party in the district.
“We are not ready to accept this shameful decision and have decided to contest the elections as independent candidate,” they said.
PTI: Pakistan Tehreek-i-Insaf candidates here on Sunday complained about change in their electoral symbols.
Talking to journalists in Raghagan area, PTI candidates Anwarzeb Khan, Gul Zafar Khan and Dr Hamidur Rehman said that they were deprived of their party’s electoral symbol ‘bat’ after Supreme Court late night verdict.
They said that earlier returning officers awarded them electoral symbol of ‘wall clock’ on Saturday night. However, they said that their symbols were replaced with other ones on Sunday morning.
They claimed that per rules, it was the privilege of former lawmakers to give them their favourite electoral symbols. However, they said that returning officers didn’t follow the rules and withdrew their earlier symbols without citing any legal reason.
Published in Dawn, January 15th, 2024
",https://www.dawn.com/news/1805892/bajaur-ppp-leaders-to-contest-polls-as-independent-candidates,peshawar,2024-01-15
9,"Six women among ANP ticket holders for NA, PA seats","Khadija Bibi contesting election from NA-1, Chitral","PESHAWAR: Awami National Party on Sunday named national and provincial assembly candidates for the Feb 8 elections in Khyber Pakhtunkhwa with one woman contesting polls on NA general seat and five on PA seats. 
Khadija Bibi is contesting the election from NA-1, Chitral. 
The party awarded tickets to 32 candidates for NA seats in KP, and 95 tickets with five women for the provincial assembly seats. 
KP has 45 NA general seats and 115 provincial assembly seats. 
The women candidates for PA seats include Shaheen Zameer from PK-40, Mansehra, Shahnaz Raja from PK-42, Abbottabad, Farazia Shaheen, PK-46, Haripur, Irum Fatima, PK-47, Haripur, and Samar Haroon Bilour, PK-83, Peshawar. 

Khadija Bibi contesting election from NA-1, Chitral 

The list of candidates shows the party’s provincial president Aimal Wali Khan is contesting the election from NA-25, Charsadda-II, and central senior vice-president Ameer Haider Hoti from NA-22, Mardan-2, and PK-58, Mardan-5, while party’s central general secretary Mian Iftikhar Hussain will contest from PK-89, Nowshera-5. 
The contestants for NA seats include Khadija Bibi for NA-1, Chitral, Ayub Khan Ashary NA-2 Swat-I, Dr Sherbaz Khan NA-3 Swat-II, M Saleem Khan NA-4 Swat-III, Haji Bahadur Khan NA-06 Lower Dir-I, Zahid Khan NA-07 Lower Dir-2, Maulana Khanzeb NA-8 Bajaur, Rauf Khan NA-10 Buner, Aurangzeb Khan NA-11 Shangla, Sarzamin Khan NA-12 Kohistan, Shah Nawaz Khan NA-19 Swabi-1, Waris Khan NA-20 Swabi -II, Ahmad Ali Khan NA-21 Mardan-I, Ameer Haider Khan Hoti NA-22 Mardan-II, Ahmad Khan Bahadur NA-23 Mardan -III, Irfan Alam NA-24 Charsadda-1, Aimal Wali Khan NA-25 Charsadda-II, Nisar Mohmand NA-26 Mohmand, Shah Hussain Shinwari NA-27 Khyber, Sheikh Fayaz NA-28 Peshawar-I, Saqibullah Khan Chamkani NA-29 Peshawar-2, Arbab Zain Omar NA-30 Peshawar-3, Pir Haroon Shah NA-31 Peshawar -IV, Haji Ghulam Ahmad Bilour NA-32 Peshawar -V, Khan Pervez (Khan Baba) NA-33 Nowshera-I, Mian Babar Shah Kakakhel NA-34 Nowshera-II, Noor Aslam Khan Afridi NA-35 Kohat, Hamid Toofan NA-38 Karak, Ashraf Dawar NA-40 North Waziristan, Arshad Mansoor Khan NA-42 Tank/DI Khan, Hamidullah, NA-43 South Waziristan/South Waziristan Lower, and Shahi Khan Sherani NA-45 DI Khan-II. 
The list of provincial assembly candidates include Mumtaz Ali Qazi Advocate PK-1 Chitral, PK-2 Chitral Syed Iftikhar Jan, PK-3 Swat Syed Jafar Shah, PK-5 Swat Mian Huzaifa, PK-6 Swat Asimullah Khan, PK-7 Swat Sher Shah Khan, PK-8 Swat Iftikhar Khan, PK-9 Swat Mumtaz Ali, PK-10 Swat Zahir Shah Khan, PK-11 Upper Dir Haji Gul Sher, PK-12 Upper Dir Ameer Zaman Khan, PK-14 Lower Dir Malak Mohammad Zeb, PK-15 Lower Dir Malak Wasil Khan, PK-16 Lower Dir Malak Sajjad Khan, PK-17 Lower Dir Haji Bahadur Khan, PK-18 Lower Dir Mubarak Shah Khilji, PK-19 Bajaur-I Malak Hikmat Khan, PK- 20 Bajaur-II Gul Afzal Khan, PK-21 Bajaur-III Rasheed Khan, PK-22 Bajaur-IV Shah Naseer Khan, PK-23 Malakand -I Izhar Khan, PK-24 Malakand-II Irshad Mohmand, PK-25 Buner-1 Afsar Khan, PK-26 Buner-2 Qaisr Wali Khan, PK-27 Buner-3 Sardar Hussain Babak, PK-28 Shangla-I Mutawakil Khan, PK-29 Shangla-II Faisal Zeb Khan, PK-30 Shangla-III Shah Farooq Khan, PK-31 Kohistan Upper Zardad Khan, PK-32 Kohistan Lower Saranzeb Khan, PK-33 Kolai-Palas Kohistan Minjahuddin, PK-34 Battagram-I Mohammad Arshad Khan, PK-35 Battagram-II Mohammad Siddique, PK-40 Mansehra-V Shaheen Zameer, PK-41 Torghar Zareen Gul Bacha, PK-42 Abbottabad-I Shehnaz Raja, PK-46 Haripur-I Farazia Shaheen, PK-47 Haripur-II Irum Fatima, PK-49 Swabi-I Sohail Ahmad, PK-50 Swabi -II Nawabzada, PK- 51 Swabi-III Sikandar Irfan, PK-52 Swabi-IV Tauseef Ijaz Yousafzai, PK-53 Swabi-V Mohammad Zahid, PK-54 Mardan-I Gohar Ali Bacha, PK-55 Mardan-II Mohammad Sohail Bacha, PK-56 Mardan-III Abdul Aziz Khan, PK-57 Mardan-IV Ahmad Khan Bahadur, PK-58 Mardan-V Ameer Haider Khan Hoti, PK-59 Mardan-VI Haroon Khan, PK-60 Mardan-VII Sher Afghan Khan, PK-61 Mardan-VIII Jamal Nasir Khan, PK- 62 Charsadda-I Gul Bacha, PK-63 Charsadda-II Shakeel Bashir Khan, PK-64 Charsadda-III Sultan Mohammad Khan, PK-65 Charsadda-IV Shehzaduddin, PK-66 Charsadda-V Mairaj Khan, PK-67 Mohmand-I Nisar Mohmand, PK-68 Mohmand-II Arzameen Khan Safi, PK-69 Khyber-I Shah Hussain Shinwari, PK-70 Khyber-II Suleman Shah, PK-71 Khyber-III Siddique Chiragh Afridi, PK-72 Peshawar-I Aziz Ghafar, PK-73 Peshawar-II Nisbatullah Khan, PK-74 Peshawar-III Arbab Allah Yar, PK- 75 Peshawar-IV Arbab Usman Khan, PK-76 Peshawar-V Khushdil Khan, PK-77 Peshawar-VI Salahuddin Mohmand, PK-78 Peshawar-VII Izhar Khalil, PK-79 Peshawar-VIII Saddique Afridi, PK-80 Peshawar-IX Yaseen Khalil, PK-81 Peshawar-X Arsalan Khan, PK-82 Peshawar-XI Dr Naveedullah Khan, PK-83 Peshawar-XII Samar Haroon Bilour, PK-84 Peshawar-XIII Malak Farhad, PK-85 Nowshera-I Eng Hamid Khan, PK-86 Nowshera-II Masaood Abbas Khattak, PK-87 Nowshera-III Jawad Khattak, PK-88 Nowshera-IV Jamshed Khan, PK-89 Nowshera-V Mian Iftikhar Hussain, PK-90 Kohat- I Yaqoob Khan, PK-91 Kohat-II Masood Khalil, PK- 92 Kohat-III Asmatullah Khattak, PK-93 Hangu Amanullah Khan, PK-95 Kurram-I Noroz Khan Orakzai, PK-97 Karak-I Gul Sahib Khan, PK-98 Karak-II Dr Mushtaq Ahmad, PK-99 Bannu-I Noorani Khan, PK-100 Bannu-II Asghar Nawaz Advocate, PK-104 North Waziristan-II Ashraf Dawar, PK-107 Lakki Marwat-III Malak Ali Sarwar, PK-110 South Waziristan Lower Ayaz Wazir, PK-112 DI Khan-II Abdul Rahim Bitani, PK-113 DI Khan-III Taimur Ali Khan, PK-114 DI Khan-IV Atta Mohammad Khan and PK-115 DI Khan-V Shahi Khan Sherani.
Published in Dawn, January 15th, 2024
",https://www.dawn.com/news/1805891/six-women-among-anp-ticket-holders-for-na-pa-seats,peshawar,2024-01-15
10,PML-N candidate in Battagram joins JUI-F,BATTAGRAM: Pakistan Muslim League-Nawaz candidate for PK-35 Nawabzada Wali Mohammad Khan quit the party and joined...,"BATTAGRAM: Pakistan Muslim League-Nawaz candidate for PK-35 Nawabzada Wali Mohammad Khan quit the party and joined Jamiat Ulema-i-Islam-Fazl.
He said that earlier they formed coalition with JUI-F and decided that PML-N would not issue ticket for National Assembly seat in the district, NA-13, and PK-34 to its workers and would support JUI-F candidates in both the constituencies.
He said that JUI-F also withdraw its candidate and decided to support PML-N candidate for PK-35. He added that all matters were settled down with consent of elders of both the parties.
Mr Khan said that suddenly retired Capt Safdar visited Battagram and issued party tickets to Sardar Moeen and Adil Nawaz Khan for both the seats without considering ground realities of politics in the district. He said that after such decisions, it was not possible for him to carry on with PML-N. He quit PML-N and joined JUI-F.
He said that their family was famous for loyalty in local politics and they never gave up fulfilling commitments. Nawabzada Wali was a strong candidate of PML-N and could possibly win the seat.  
Published in Dawn, January 15th, 2024
",https://www.dawn.com/news/1805890/pml-n-candidate-in-battagram-joins-jui-f,peshawar,2024-01-15
11,Charsadda elders’ body extends support to QWP candidates,CHARSADDA: The members of Hashtnagar Qaumi Olasi Ittehad (HQOI) have extended their support to Qaumi Watan Party...,"CHARSADDA: The members of Hashtnagar Qaumi Olasi Ittehad (HQOI) have extended their support to Qaumi Watan Party candidates for the national and provincial assemblies’ seats in Charsadda district. 
The decision was taken at a jirga of QWP and HQOI leaders here on Sunday. The jirga was attended by a large number of elders of the Ittehad. They unanimously decided to support candidates of QWP in the elections scheduled to be held on Feb 8. They promised to fully back QWP candidates to ensure their success. 
Addressing the jirga, QWP provincial chairman Sikandar Hayat Khan Sherpao thanked the Ittehad leaders, political and social figures for their support to QWP candidates. 
He said joint struggle would be waged for the development and welfare of the people of the district. He said that Qaumi Watan Party would raise its voice at every forum to achieve the rights of the province, including resolving the basic problems of the region and the people. 
Published in Dawn, January 15th, 2024
",https://www.dawn.com/news/1805889/charsadda-elders-body-extends-support-to-qwp-candidates,peshawar,2024-01-15
12,Jamaat won’t allow delay in polls: Sen Mushtaq,LOWER DIR: Jamaat-i-Islami Senator Mushtaq Ahmad Khan has urged the Election Commission of Pakistan and the Supreme...,"LOWER DIR: Jamaat-i-Islami Senator Mushtaq Ahmad Khan has urged the Election Commission of Pakistan and the Supreme Court to provide level playing field to all the political parties, ensure the general elections are held on the scheduled date and ‘avoid depriving’ Pakistan Tehreek-i-Insaf of its election symbol. 
He was addressing a party workers’ convention in Talash here the other day.   JI Youth Wing Talash chapter organised the event. 
JI candidate for NA-7 Maulana Dr Mohammad Ismail, PK-16 candidate Shad Nawaz Khan, former tehsil nazim Riaz Mohammad, JI Youth Wing district president Ateequr Rehman, JI tehsil emir Malik Sher Bahadar and others also spoke on the occasion. 
Realising the importance of youth vote, Senator Mushtaq said 130 million youth would decide the country’s direction in the Feb 8 elections. 
He asked the JI Youth Wing to mobilise youngsters and women to vote for party. He said if voted to power, the JI would provide education to every child, healthcare to every citizen and would distribute national resources equally among the provinces.  
The Jamaat leader said his party won’t allow anyone to delay elections on any pretext.  
Senator Mushtaq condemned the arrest of Pakhtun Tahaffuz Movement chief Manzoor Pashteen and termed it illegal and unconstitutional. The JI chief also condemned the ‘forced disappearance’ of Baloch people. 
He said the JI had been struggling for the enforcement of Islamic system through ballot in the country that guaranteed equal facilities of education, healthcare and shelter to citizens and ensured justice to all irrespective of people’s social and economic status. 
He said the Islamic system would rid Pakistan of ‘slavery’ of IMF, World Bank and the US. He said the JI wanted across the board accountability of the judges, generals and bureaucrats. He alleged rulers had looted national wealth and shifted it abroad. He said JI would take into account all the elements involved in plundering the national wealth. 
Talking about the justice system, the JI senator said 2.1 million cases were pending in courts. He alleged the country was being ruled by ‘mafias’ that had roots in parliament and judiciary. 
“Some individuals and political parties want to postpone the election in the garb of militancy, but the JI won’t let it happen,” Mushtaq said, adding delaying polls was tantamount to surrendering before the militants. 
The JI senator said prices of daily use items were increasing on weekly basis, while millions of educated youth were jobless. 
The JI senator was of the view that free, fair and transparent elections were the only solution to all problems faced by the nation. He said depriving a political party of its election symbol and arresting its candidates was not fair.
Published in Dawn, January 15th, 2024
",https://www.dawn.com/news/1805888/jamaat-wont-allow-delay-in-polls-sen-mushtaq,peshawar,2024-01-15
13,SCCI chief seeks immediate resolution of gas shortage issue,PESHAWAR: Sarhad Chamber of Commerce and Industry president Fuad Ishaq has expressed grave concerns over increasing...,"PESHAWAR: Sarhad Chamber of Commerce and Industry president Fuad Ishaq has expressed grave concerns over increasing environmental pollution as people use alternative sources of fuel owing to low gas pressure issue.
He urged the caretaker chief minister, governor, chief secretary and district administration to contact federal caretaker government immediately and resolve the issues once for all.
According to a press release, Mr Ishaq held a meeting with the additional deputy commissioner, Sania Safi, in her office here on Sunday. The presidents of city bazaars, trader leaders and members of business community were present in a large number in the meeting.
He told the additional deputy commissioner that SCCI had taken up the issue of low gas pressure with federal government and relevant ministry in an efficient way because Khyber Pakhtunkhwa was treated in an unjust way.
The SCCI chief said people in Khyber Pakhtunkhwa were compelled to use traditional ways as alternative sources of fuel for fulfillment of requirements of routine life. “Traditional methods like use of timber, coal and other sources are causing an increase in environment pollution, which can cause lungs and respiratory diseases,” he added.
He said that the total gas production of Khyber Pakhtunkhwa was 550 MMCFDs whereas gas consumption in the province was 200MMCFDs. He said that the rest of 350MMCFDs gas was given to national grid. If the 200MMCFDs gas was fully supplied to the province, the issues would be resolved, he added.
Mr Ishaq said that resolution of gas issue would remove tension of people along with the wheel of business and industries would continue to run. He added that people would also avail employment opportunities in the province if the issue was resolved.
He said that KP was put into the basket of RLNG while subsidy was given to Punjab. In KP, 3900MMBTU gas was supplied to commercial consumers and 2700MMBTU to industrial consumers while fertiliser sector was provided gas at low cost in Punjab, he added. 
He said that the weighted average cost of gas (WACOG) policy should be determined at provincial level.
Published in Dawn, January 15th, 2024
",https://www.dawn.com/news/1805887/scci-chief-seeks-immediate-resolution-of-gas-shortage-issue,peshawar,2024-01-15
14,KMU associate professor serves legal notice on KMC dean,Seeks public apology for using ‘objectionable’ language against her,"PESHAWAR: An associate professor of Khyber Medical University has served a legal notice on the principal/dean Khyber Medical College (KMC), asking him to tender unconditional apology within 14 days for using ‘highly inappropriate and objectionable’ language against her at an official meeting.
The legal notice was served by Dr Brekhna Jameel, who is director/associate professor (BPS-20) Institute of health Professions Education and Research, KMU, through a senior lawyer Neelam A Khan on the KMC’s Dean Prof Dr Mahmud Auragnzeb.
The legal action is in response to alleged defamation arising from ‘inappropriate language and false accusations’ leveled during a meeting on Jan 10.
Dr Jameel, who is also president of Khyber Medical University (KMU) Employees Union, contends that Dean Mahmud Aurangzeb, in his official capacity, used ‘highly objectionable’ language and engaged in inappropriate actions, such as creating caricatures and insinuating misconduct against her.
She claims that these actions have caused significant harm to both her personal and professional reputation.

Seeks public apology for using ‘objectionable’ language against her

In the notice the lawyer Neelam A Khan, who is also senior vice president of the Supreme Court Bar Association, has asked the dean that her client would initiate both civil and criminal proceedings against him if he failed to tender proper/ unconditional apology, circulate it on social media as well as in four leading newspapers.
It is added that the civil proceedings would be initiated for recovery of damages to the tune of two billion rupees.
The notice states that Dr Jameel had more than 15 years of academic, research and administrative experience in health professions education and research and had published more than 50 research articles in reputed journals.
It states that she has established the Institute of Health Professions Education and Research at KMU, which is well reputed across the country for faculty development programs.
It is added that the transcript of the meeting held on Jan 10 at Khyber Teaching Hospital’s auditorium called by the hospital medical director was attended by faculty members and administrative staff of KMC, Khyber College of Dentistry and KTH.
It is stated that the language used by the dean against her was unbecoming of a senior officer.
The notice emphasizes on the severity of the allegations, asserting that they have inflicted irreparable damage to Dr Jameel’s pristine record.
As an accomplished professional and President of the KMU Employees Association, she underscores the potential far-reaching consequences within the societal context.
Dr Jameel reiterates her unwavering commitment to the noble profession of teaching while highlighting the urgency to rectify the harm caused by Dean Aurangzeb’s actions.
Published in Dawn, January 15th, 2024
",https://www.dawn.com/news/1805886/kmu-associate-professor-serves-legal-notice-on-kmc-dean,peshawar,2024-01-15
